,Title,URL,Views,Likes,Dislikes,Score
0,NASA Live Earth From Space HDVR xe2 x99 xa5 ISS LIVE FEED AstronomyDay2018 Subscribe now YouTube,https://www.youtube.com/watch?v=RtU_mdL2vBM,1,1159396,60260,9.098055199720507e-07
1,NASA TV Public Education YouTube,https://www.youtube.com/watch?v=wwMDvPCGeE0,1,164988,9594,6.435254900446607e-06
2,Time Lapse Collection Earth from space Images from astronauts on the ISS YouTube,https://www.youtube.com/watch?v=qyEzsAy4qeU,1,88254,4123,1.1886225053785169e-05
3,NASA TV Media YouTube,https://www.youtube.com/watch?v=P11y8N22Rq0,1,29407,2043,3.654436485893875e-05
4,Live Train 24 24 Train Driver 39 s View Cab View in Norway Rail World Line Snow Cover in WINTER YouT,https://www.youtube.com/watch?v=DhPYnvZmFQA,1,14728,735,7.14643035803616e-05
5,Hubble Space Telescope The Wonders Of The Universe NASA Hubble Telescope Astronomy Videos YouTube,https://www.youtube.com/watch?v=5_-rh6L1jiU,1,6799,438,0.00015720798616569723
6,Physics in 6 minutes YouTube,https://www.youtube.com/watch?v=t215Q1oBoXQ,321476,14069,597,23.862529691211403
7,Does Your Company Need an AI Strategy YouTube,https://www.youtube.com/watch?v=DJNVVNjHKAM,239,10,0,23.9
8,Half Derivative of x YouTube,https://www.youtube.com/watch?v=gaAhCTDc6oA,34500,1460,38,24.261603375527425
9,How to setup a Machine Learning and Deep Learning Environment YouTube,https://www.youtube.com/watch?v=WQt4H1Bo0jM,2523,98,0,25.744897959183675
10,The Most Scientific Way to Train Your BACK In 2018 Training Science Explained YouTube,https://www.youtube.com/watch?v=12xHxUnBEiI,559153,21980,271,25.756736837256437
11,Why sin and cos don 39 t mean anything YouTube,https://www.youtube.com/watch?v=AzVL432lEWA,266071,10865,655,26.059843290891283
12,Life Lessons From 100 Year Olds YouTube,https://www.youtube.com/watch?v=9AThycGCakk,6500956,249425,2408,26.31784856912682
13,But what is a Neural Network Chapter 1 deep learning YouTube,https://www.youtube.com/watch?v=aircAruvnKk,1292528,47981,295,27.10497840036908
14,My journey into Software Engineering YouTube,https://www.youtube.com/watch?v=U8pBOsx--d0,184941,6554,65,28.500693481276006
15,How I Learned to Code and Got a Job at Google YouTube,https://www.youtube.com/watch?v=mElVGah7Epg,769595,26751,455,29.266618497109828
16,What Is Dynamic Programming and How To Use It YouTube,https://www.youtube.com/watch?v=vYquumk4nWw,102583,3500,50,29.734202898550723
17,The 3 Myths of the Indian Education System Vinay Menon TEDxThiruvananthapuram YouTube,https://www.youtube.com/watch?v=9Q7Zl3OI4us,582520,19966,441,29.83457106274008
18,The hardest problem on the hardest test YouTube,https://www.youtube.com/watch?v=OkmNXy7er84,1737357,55660,772,31.652765631832093
19,The Secrets Of Vibration amp Frequency The Power Of Sound YouTube,https://www.youtube.com/watch?v=_aeeNMk04l0,537142,17203,355,31.88164767331434
20,Let 39 s teach for mastery not test scores Sal Khan YouTube,https://www.youtube.com/watch?v=-MTRxRO5SRA,870024,26446,193,33.13998400182836
21,Why I Left My 100 000 Job at Google YouTube,https://www.youtube.com/watch?v=4KcMdH8qiuk,2552973,80771,5011,33.69816525871172
22,That 39 s How You Can Confuse Your Math Teacher YouTube,https://www.youtube.com/watch?v=kYmjEu7uZKI,1354054,44144,4863,34.4709656067819
23,Machine Learning amp Artificial Intelligence Crash Course Computer Science 34 YouTube,https://www.youtube.com/watch?v=z-EtmaFJieY,195480,5427,81,36.56565656565657
24,Bell 39 s Theorem The Quantum Venn Diagram Paradox YouTube,https://www.youtube.com/watch?v=zcqZHYo7ONs,2705494,76276,2548,36.69561089409722
25,What Is AI Artificial Intelligence For Beginners YouTube,https://www.youtube.com/watch?v=mQlCSPeqmrc,4227,115,0,36.756521739130434
26,Limits Chapter 7 Essence of calculus YouTube,https://www.youtube.com/watch?v=kfF40MiS7zA,183995,5052,53,36.80636127225445
27,Why Math Might Be Complete BS Answers With Joe YouTube,https://www.youtube.com/watch?v=d9wfw_98NJ4,96037,2779,215,37.455928237129484
28,What do programmers actually do YouTube,https://www.youtube.com/watch?v=g4a7_HH9Wbg,711177,20546,1584,37.505379179411456
29,So You Want To Be a Physics Major YouTube,https://www.youtube.com/watch?v=Y9RnTpIl8TY,36691,933,11,39.79501084598699
30,What 39 s a Tensor YouTube,https://www.youtube.com/watch?v=f5liqUk0ZTw,988936,25232,384,39.799420476497104
31,AI cannot be deployed in isolation it needs Architecture YouTube,https://www.youtube.com/watch?v=9DkD6NOsWvI,842,21,0,40.095238095238095
32,AI quot Stop Button quot Problem Computerphile YouTube,https://www.youtube.com/watch?v=3TYT1QfdfsM,502201,13067,544,40.102291783119064
33,Times Tables Mandelbrot and the Heart of Mathematics YouTube,https://www.youtube.com/watch?v=qhbuKbxJsk8,573365,14316,150,40.47472822250459
34,Vectors The Math of Intelligence 3 YouTube,https://www.youtube.com/watch?v=s0Q3CojqRfM,48887,1218,28,41.081512605042015
35,Roadmap How to Learn Machine Learning in 6 Months YouTube,https://www.youtube.com/watch?v=MOdlp1d0PNA,131791,3164,55,42.39015760694757
36,What is this Product MIT Integration Bee 15 YouTube,https://www.youtube.com/watch?v=qn7z9T-dezw,57011,1383,60,43.09221466364323
37,P vs NP An Introduction YouTube,https://www.youtube.com/watch?v=OY41QYPI8cw,30269,698,0,43.365329512893986
38,Why can 39 t you go faster than light YouTube,https://www.youtube.com/watch?v=A2JCoIGyGxc,626720,14941,639,43.82044469304992
39,Cybersecurity Crash Course Computer Science 31 YouTube,https://www.youtube.com/watch?v=bPVaOlJ6ln0,159489,3723,95,43.96058434399118
40,What is an Eigenvector YouTube,https://www.youtube.com/watch?v=ue3yoeZvt8E,134438,3083,38,44.1504105090312
41,Visualization of Quantum Physics Quantum Mechanics YouTube,https://www.youtube.com/watch?v=p7bzE1E5PMY,1080774,24947,522,44.24867963152508
42,Sean Carroll Layers Of Reality The Complexity of The Universe YouTube,https://www.youtube.com/watch?v=lu2eTsbZrGA,56975,1326,58,44.93296529968454
43,Calculus at a Fifth Grade Level YouTube,https://www.youtube.com/watch?v=TzDhdvVg9_c,514301,11998,565,44.98390623633342
44,Thinking visually about higher dimensions YouTube,https://www.youtube.com/watch?v=zwAD6dRSVyI,1253473,28374,697,45.28933771723814
45,Lambda Calculus Computerphile YouTube,https://www.youtube.com/watch?v=eis11j_iGMs,284912,6425,214,45.87216229270649
46,Dynamic Programming Interview Question 1 Find Sets Of Numbers That Add Up To 16 YouTube,https://www.youtube.com/watch?v=nqlNzOcnCfs,32595,718,25,47.03463203463203
47,How Not to be Boring YouTube,https://www.youtube.com/watch?v=M9i2HAE-ZSw,3301738,72455,2278,47.048719665987434
48,A Japanese Method to Develop Creativity in Kids YouTube,https://www.youtube.com/watch?v=kXnugJEcVE8,725623,16071,663,47.09391225337487
49,A visual guide to Bayesian thinking YouTube,https://www.youtube.com/watch?v=BrK7X_XlGB8,589661,12945,614,47.81939826453653
50,Increase Your Vibration on a Super High Frequency xf0 x9f x92 xa5 Life Changing xf0 x9f x92 xa5 YouT,https://www.youtube.com/watch?v=DbjjRRsBbXA,415176,8910,433,48.97676064645511
51,What Does An Atom REALLY Look Like YouTube,https://www.youtube.com/watch?v=EOHYT5q5lhQ,677898,14859,1027,49.0093984962406
52,Major in Computer Science vs Software Engineer 3 Sample Interview Questions YouTube,https://www.youtube.com/watch?v=cSVDk-ugAQs,139381,2955,123,49.21645480225989
53,Hill Climbing Algorithm amp Artificial Intelligence Computerphile YouTube,https://www.youtube.com/watch?v=oSdPmxRCWws,284750,5834,114,49.78146853146853
54,Writing Integral in Terms of Itself MIT Integration Bee 21 YouTube,https://www.youtube.com/watch?v=nlvmD6LKYXo,40151,844,39,49.877018633540374
55,Google 39 s Deep Mind Explained Self Learning A I YouTube,https://www.youtube.com/watch?v=TnUYcTuZJpM,2578882,53096,1462,49.945423558120616
56,Vectors what even are they Essence of linear algebra chapter 1 YouTube,https://www.youtube.com/watch?v=fNk_zzaMoSs,606735,12106,57,50.355631172711426
57,Andrew Ng The State of Artificial Intelligence YouTube,https://www.youtube.com/watch?v=NKpuX_yzdYs,142365,2902,98,50.77211126961483
58,What is 0 to the power of 0 YouTube,https://www.youtube.com/watch?v=r0_mi8ngNnM,1390000,27869,1011,51.753667436145655
59,The World 39 s Best Mathematician Numberphile YouTube,https://www.youtube.com/watch?v=MXJ-zpJeY3E,1609117,31112,490,52.54774345241983
60,How To Understand Quantum Superposition YouTube,https://www.youtube.com/watch?v=hkmoZ8e5Qn0,15881,301,0,52.76079734219269
61,Google 39 s self learning AI AlphaZero masters chess in 4 hours YouTube,https://www.youtube.com/watch?v=0g9SlVdv1PY,527441,10254,299,52.982521346057254
62,Learning Algorithms Is It REALLY Necessary YouTube,https://www.youtube.com/watch?v=FJcG-6g4wA4,75836,1479,54,53.21824561403509
63,A Beginner xe2 x80 x99s Guide To Quantum Computing YouTube,https://www.youtube.com/watch?v=JRIPV0dPAd4,283101,5527,297,54.1302103250478
64,Inverse matrices column space and null space Essence of linear algebra chapter 6 YouTube,https://www.youtube.com/watch?v=uQhTuRlWMxw,329110,6008,30,55.05352960856474
65,A refrigerator that works by stretching rubber bands YouTube,https://www.youtube.com/watch?v=lfmrvxB154w,2546270,47959,1884,55.26359196961476
66,PTE Speaking Retell Lecture METHOD with Jay YouTube,https://www.youtube.com/watch?v=U9iYnbHd5ys,118404,2185,46,55.354838709677416
67,Gravity YouTube,https://www.youtube.com/watch?v=-fhWuEt5yKc,32718,597,13,56.023972602739725
68,Top 5 Programming Languages to Learn in 2018 to Get a Job Without a College Degree YouTube,https://www.youtube.com/watch?v=f3EbDbm8XqY,197890,3803,300,56.49157864687411
69,MIT AGI Future of Intelligence Ray Kurzweil YouTube,https://www.youtube.com/watch?v=9Z06rY3uvGY,60176,1112,51,56.71630537229029
70,What is Machine Learning in 3 minutes YouTube,https://www.youtube.com/watch?v=1Hx8_BAfgj8,511,9,0,56.77777777777778
71,a day in the life of a software engineer YouTube,https://www.youtube.com/watch?v=rqX8PFcOpxA,1905522,35999,2523,56.922033695782055
72,The 7 Steps of Machine Learning YouTube,https://www.youtube.com/watch?v=nKW8Ndu7Mjw,601743,10842,273,56.9347147317627
73,William Ackman Everything You Need to Know About Finance and Investing in Under an Hour YouTube,https://www.youtube.com/watch?v=WEDIj9JBTC8,2510436,44587,713,57.21921867165064
74,Indeterminate the hidden power of 0 divided by 0 YouTube,https://www.youtube.com/watch?v=oc0M1o8tuPo,636286,11345,360,57.92316795630405
75,How to Invest 1 000 xf0 x9f x92 xb5 and grow it to 1 Million YouTube,https://www.youtube.com/watch?v=t456xfXL-Bs,945765,17920,1658,58.157975648751695
76,Clutch How does it work YouTube,https://www.youtube.com/watch?v=devo3kdSPQY,5014591,87556,1781,58.462150976391726
77,What is Artificial Intelligence In 5 minutes YouTube,https://www.youtube.com/watch?v=2ePf9rue1Ao,104669,1814,29,58.63809523809524
78,Should you Learn C in 2018 YouTube,https://www.youtube.com/watch?v=7xVrYnyQ04M,534249,10162,1061,58.70223052411823
79,Inspiring the next generation of female engineers Debbie Sterling TEDxPSU YouTube,https://www.youtube.com/watch?v=FEeTLopLkEo,650953,11170,332,60.062096327735745
80,How to be Ready for Jobs in an Artificial Intelligence Driven World YouTube,https://www.youtube.com/watch?v=gJRVh68P47Y,11080,198,15,60.54644808743169
81,Applying Machine Learning to Understand Your Competitor YouTube,https://www.youtube.com/watch?v=x6zshJqLPwY,608,10,0,60.8
82,Business English Vocabulary The Stock Market YouTube,https://www.youtube.com/watch?v=DBpV4XtWl1U,240347,3981,36,60.92446134347275
83,Why people believe they can xe2 x80 x99t draw and how to prove they can Graham Shaw TEDxHull YouTube,https://www.youtube.com/watch?v=7TXEZ4tP06c,18644214,316984,11775,61.086711073395605
84,A Friendly Introduction to Machine Learning YouTube,https://www.youtube.com/watch?v=IpGxLWOIZy4,412568,6837,86,61.11213153606873
85,Computer Science vs Self Taught vs Coding Bootcamp ft Quincy Larson YouTube,https://www.youtube.com/watch?v=_FioceDs7JA,416470,7029,285,61.75415183867141
86,Is Earth Actually Flat YouTube,https://www.youtube.com/watch?v=VNqNnUJVcVs,19992724,349948,26822,61.87284217302229
87,3000 ball bearings show crystal defects with Matt Parker YouTube,https://www.youtube.com/watch?v=O3RsDIWB7s0,1051445,18052,1191,62.35958721309531
88,Two Feet Love Is A Bitch YouTube,https://www.youtube.com/watch?v=_DjE4gbIVZk&amp;list=PLMmqTuUsDkRICG_7HkmgGV081DGDjEFxe,24796848,397788,5024,63.13421800368669
89,Euler 39 s Identity YouTube,https://www.youtube.com/watch?v=sKtloBAuP74,153100,2514,112,63.73855120732723
90,Quantum Mechanics Part 1 Crash Course Physics 43 YouTube,https://www.youtube.com/watch?v=7kb1VT0J3DE,668115,10827,351,63.77577319587629
91, quot Uncle quot Bob Martin quot The Future of Programming quot YouTube,https://www.youtube.com/watch?v=ecIWPzGEbFc,354295,5824,283,63.940624436022375
92,This is what a computer science exam looks like at university YouTube,https://www.youtube.com/watch?v=-hZgyXjEPbE,48371,798,43,64.06754966887418
93,Mechanical Vs Electrical Engineering How to Pick the Right Major YouTube,https://www.youtube.com/watch?v=-XpXlc2Wux4,216418,3393,63,64.99039039039039
94,William Byrd on quot The Most Beautiful Program Ever Written quot YouTube,https://www.youtube.com/watch?v=OyfBQmvr2Hc,50055,789,20,65.09102730819245
95,Donald Sadoway The missing link to renewable energy YouTube,https://www.youtube.com/watch?v=Sddb0Khx0yA,323562,5050,111,65.51164203280017
96,How to triple your memory by using this trick Ricardo Lieuw On TEDxHaarlem YouTube,https://www.youtube.com/watch?v=JsC9ZHi79jo,583895,9359,475,65.7243358847366
97,Hubble Space Telescope Re imagining the Universe Zoltan Levay TEDxKC YouTube,https://www.youtube.com/watch?v=JDJsiEI_0gE,20589,313,0,65.77955271565496
98,Gerry Sussman We Really Don 39 t Know How to Compute YouTube,https://www.youtube.com/watch?v=O3tVctB_VSU,17281,261,0,66.21072796934865
99,Lesson 1 Voltage Current Resistance Engineering Circuit Analysis YouTube,https://www.youtube.com/watch?v=OGa_b26eK2c,189934,2869,50,67.37637460092232
100,What is Computer Engineering YouTube,https://www.youtube.com/watch?v=avZTQgLs064,172303,2562,44,68.42851469420175
101,How NASA is answering the question Are we alone Shawn Domagal Goldman TEDxMidAtlantic YouTube,https://www.youtube.com/watch?v=Lp7BL-UI0Rw,31513,520,69,69.87361419068736
102,15 Yr Old Kelvin Doe Wows M I T YouTube,https://www.youtube.com/watch?v=XOLOLrUBRBY,13240107,189805,3241,70.9681771402843
103,Lawrence Krauss Physics Made Easy YouTube,https://www.youtube.com/watch?v=osjdfQllQD0,299166,4387,181,71.1283880171184
104,Is computer programming hard to learn Mark Zuckerberg Bill Gates YouTube,https://www.youtube.com/watch?v=IoPx_rSicrM,736116,10747,463,71.57876312718787
105,Yann LeCun Power amp Limits of Deep Learning YouTube,https://www.youtube.com/watch?v=0tEhw5t6rhc,35784,514,17,72.0
106,Calculus in 20 minutes Reviewing Calculus YouTube,https://www.youtube.com/watch?v=di_bzYD0Mkg,468962,6643,202,72.80888060860114
107,So you want AI for your business Where do you start YouTube,https://www.youtube.com/watch?v=dfvycjYIMPo,1675,23,0,72.82608695652173
108,Computer science education why does it suck so much and what if it didn xe2 x80 x99t Ashley Gavin TE,https://www.youtube.com/watch?v=5jmN_tBS0t4,402171,6376,864,72.9628084179971
109,Secret That Guarantees You 39 ll Be Rich or Broke How Money Works YouTube,https://www.youtube.com/watch?v=WYaEimjikLo,339777,5154,518,73.29098360655738
110,We Talked To Sophia xe2 x80 x94 The AI Robot That Once Said It Would 39 Destroy Humans 39 YouTube,https://www.youtube.com/watch?v=78-1MlkxyqI,2330524,33496,1745,73.40001889704261
111,How to learn any language in six months Chris Lonsdale TEDxLingnanUniversity YouTube,https://www.youtube.com/watch?v=d0yGdNEWdn0,12494646,174201,4641,73.68864118895966
112,A Day in the Life MIT Student YouTube,https://www.youtube.com/watch?v=ZMyKOkyAjUQ,866327,11916,325,74.74135104822707
113,Thermodynamics and the End of the Universe Energy Entropy and the fundamental laws of physics YouTub,https://www.youtube.com/watch?v=GOrWy_yNBvY,373811,5163,166,74.80708425055033
114,How I taught myself to code Litha Soyizwapi TEDxSoweto YouTube,https://www.youtube.com/watch?v=nmZR_JsLCfg,415390,5696,171,75.18371040723981
115,The Big Picture of Linear Algebra YouTube,https://www.youtube.com/watch?v=ggWYkes-n6E,95366,1253,16,77.09458367016977
116,Don 39 t Major in Engineering Well Some Types of Engineering YouTube,https://www.youtube.com/watch?v=ILDox857sYI,222669,3700,833,77.6662016044646
117,Have you ever imagined how interstellar travel could work Ryan Weed TEDxDanubia YouTube,https://www.youtube.com/watch?v=EBebWBjpWIQ,245009,3357,240,78.60410651267244
118,Learn essential finance terms amp vocabulary Free English lessons online YouTube,https://www.youtube.com/watch?v=aQeeX7xyOWI,64946,854,36,79.3960880195599
119,Assessment Strategies YouTube,https://www.youtube.com/watch?v=dWNrHmcb4Oo,722,9,0,80.22222222222223
120,Artificial Intelligence What Why How Abi Aryan TEDxNSIT YouTube,https://www.youtube.com/watch?v=skEILdakHVc,32979,441,31,80.43658536585366
121,Amazon Coding Interview Question K Closest Points to the Origin YouTube,https://www.youtube.com/watch?v=eaYX0Ee0Kcg,161513,2064,115,82.86967675731144
122,TEDxCaltech Leonard Susskind Richard Feynman YouTube,https://www.youtube.com/watch?v=hpjwotips7E,398997,4843,79,83.75251889168766
123,An evening in the life of a typical math PhD student YouTube,https://www.youtube.com/watch?v=j4hW7AwETZA,475992,6741,1099,84.36582772066643
124,What 39 s an algorithm David J Malan YouTube,https://www.youtube.com/watch?v=6hfOvs8pY1k,830546,10053,291,85.07949190739602
125,C Programming YouTube,https://www.youtube.com/watch?v=Rub-JsjMhWY,3124648,37800,1082,85.09853477858272
126,Learn English With Movies Using This Movie Technique YouTube,https://www.youtube.com/watch?v=791cOfTEkEc,4629403,56180,2060,85.53959719142647
127,How I got into MIT Alumni and students share their acceptance stories YouTube,https://www.youtube.com/watch?v=TBpEpeN-ufg,283883,3487,169,85.55846895720313
128,6 034 Recitation 7 Support Vector Machines SVMs YouTube,https://www.youtube.com/watch?v=ik7E7r2a1h8,11672,136,0,85.82352941176471
129,How algorithms shape our world Kevin Slavin YouTube,https://www.youtube.com/watch?v=ENWVRcMGDoU,255628,3040,73,86.15706100438153
130,500 English Listening Practice xf0 x9f x98 x80 Learn English Useful Conversation Phrases YouTube,https://www.youtube.com/watch?v=M-A2yJQLiWI,1344944,16471,887,86.30287474332648
131,Riemann 39 s paradox pi infinity minus infinity YouTube,https://www.youtube.com/watch?v=-EtHF5ND3_s,2015429,24390,1451,87.86036880421989
132,Understand Calculus in 10 Minutes YouTube,https://www.youtube.com/watch?v=WjJ-kpgps1c,497335,6251,643,88.68313124108417
133,Introduction to Programming YouTube,https://www.youtube.com/watch?v=lJnvq0A_7WQ,1489242,17142,478,89.36881901104177
134,11 Introduction to Machine Learning YouTube,https://www.youtube.com/watch?v=h0e2HAPTGF4,203070,2314,43,89.41875825627477
135,This is what a theoretical physics exam looks like at university YouTube,https://www.youtube.com/watch?v=4LOmW3MxkUs,252961,2965,154,89.98968338669512
136,Computer science is for everyone Hadi Partovi TEDxRainier YouTube,https://www.youtube.com/watch?v=FpMNs7H24X0,365722,4221,158,90.01279842480925
137,Quantum Theory Made Easy 1 YouTube,https://www.youtube.com/watch?v=e5_V78SWGF0,1065571,12140,314,90.10409267715204
138,Meet The 14 Year Old Quantum Physics Whiz Who xe2 x80 x99s Already Graduating College TODAY YouTube,https://www.youtube.com/watch?v=WEhETiyFPJ0,502677,5793,241,90.53980547550432
139,Course Introduction MIT 18 06SC Linear Algebra YouTube,https://www.youtube.com/watch?v=hNDFwVVKVk0,76112,837,0,90.93428912783752
140,Bernstein The greatest 5 min in music education YouTube,https://www.youtube.com/watch?v=Gt2zubHcER4,1632117,18317,433,91.2612950123015
141,MIT 6 S094 Introduction to Deep Learning and Self Driving Cars YouTube,https://www.youtube.com/watch?v=1L0TKZQcUtA,296618,3271,77,92.86725109580463
142,Amazing Technology Invented By MIT Tangible Media YouTube,https://www.youtube.com/watch?v=lvtfD_rJ2hE,14323734,157789,3654,92.92979530930678
143,Introduction to Data Analysis using Machine Learning YouTube,https://www.youtube.com/watch?v=U4IYsLgNgoY,78419,842,0,93.13420427553444
144,An Inside Tour of the International Space Station 1080p 60fps YouTube,https://www.youtube.com/watch?v=bhGydridbEA,3579045,39726,1688,94.0913034334087
145,Collin 39 s Lab Schematics YouTube,https://www.youtube.com/watch?v=9cps7Q_IrX0,614599,6593,171,95.70211772033635
146,Thermodynamics PV Diagrams Internal Energy Heat Work Isothermal Adiabatic Isobaric Physics YouTube,https://www.youtube.com/watch?v=TnDCxw0y6YM,104680,1126,33,95.77310155535224
147,Evolutionary Neural Network Learns To Drive made in Unity 3D With Download YouTube,https://www.youtube.com/watch?v=BhsgLeY_Q-Y,118280,1290,63,96.39771801140995
148,Areas in Computer Science YouTube,https://www.youtube.com/watch?v=3CLDODvcYw0,316257,3424,160,96.89246323529412
149,Introduction to Corporate Finance FREE Course Corporate Finance Institute YouTube,https://www.youtube.com/watch?v=5eGRi66iUfU,63178,665,16,97.346687211094
150,5 CREEPIEST Things Done By Artificial Intelligence Robots YouTube,https://www.youtube.com/watch?v=0hVuCWfyHP4,460517,5426,711,97.67062566277836
151,Listen To These INCREDIBLE Sounds Recorded In Space Part 2 YouTube,https://www.youtube.com/watch?v=3OtLJsgYTnY,472618,5296,470,97.93162038955657
152,Overview of Differential Equations YouTube,https://www.youtube.com/watch?v=ghjOS7Q82s0,170690,1750,13,98.2671272308578
153,Lesson 34 Resonance Forced Vibrations Demonstrations in Physics YouTube,https://www.youtube.com/watch?v=C-Bn70PpbrM,152153,1569,26,98.60855476344783
154,6 Monte Carlo Simulation YouTube,https://www.youtube.com/watch?v=OgO1gpXSUzU,116956,1187,17,99.96239316239316
155,Calculus What Is It YouTube,https://www.youtube.com/watch?v=INFoNeC1eBA,421550,4331,121,100.13064133016627
156,14 Year Old Prodigy Programmer Dreams In Code YouTube,https://www.youtube.com/watch?v=DBXZWB_dNsw,7445980,82066,7775,100.22721460203793
157,Hill Climbing Algorithm in 4 minutes Artificial Intelligence YouTube,https://www.youtube.com/watch?v=5MNRToa6okQ,1708,17,0,100.47058823529412
158,12a Neural Nets YouTube,https://www.youtube.com/watch?v=uXt8qF2Zzfo,195030,1965,24,100.47913446676971
159,Algorithms Memoization and Dynamic Programming YouTube,https://www.youtube.com/watch?v=P8Xa2BitN3I,245033,2522,90,100.75370065789474
160,RFID Blockchain AI Bitcoin The Truth Will Shock You YouTube,https://www.youtube.com/watch?v=W7nt5FynDw8,328151,3851,596,100.81443932411675
161,Ancient Vibration Energy That is Beyond our Scope of Understanding YouTube,https://www.youtube.com/watch?v=ELKb1TLgDYE,94504,1070,139,101.50805585392051
162,What We Cannot Know with Marcus du Sautoy YouTube,https://www.youtube.com/watch?v=reeU09R4TIA,185552,2030,212,102.06380638063807
163,The Birth Of Calculus 1986 YouTube,https://www.youtube.com/watch?v=ObPg3ki9GOI,382823,3792,71,102.88175221714593
164,The Concept of Mass with Jim Baggott YouTube,https://www.youtube.com/watch?v=HfHjzomqbZc,149439,1600,175,104.86947368421053
165,The Next Software Revolution Life Andrew Hessel TEDxSanFrancisco YouTube,https://www.youtube.com/watch?v=JbZiJpbY-MY,40964,443,53,105.03589743589744
166,GOTO 2015 xe2 x80 xa2 Agile is Dead xe2 x80 xa2 Pragmatic Dave Thomas YouTube,https://www.youtube.com/watch?v=a-BOSpxYJ9M,351050,3624,283,105.07333133792278
167,Probing the Drake Equation Are We Alone Fred Crawford TEDxYouth SAS YouTube,https://www.youtube.com/watch?v=Df4PIZS8EHY,21892,225,17,105.25
168,How to understand native speakers 39 questions in English YouTube,https://www.youtube.com/watch?v=t1RPmY3Xkdc,2563945,24912,593,105.42970516879807
169,Graph Traversals Breadth First and Depth First YouTube,https://www.youtube.com/watch?v=bIA8HEEUxZI,373682,3599,72,105.94896512616955
170,how to embarrass your math teacher YouTube,https://www.youtube.com/watch?v=jrQwgNxnvS0,28709223,351918,82232,106.45425791476013
171,Unit I Lec 1 MIT Calculus Revisited Single Variable Calculus YouTube,https://www.youtube.com/watch?v=rXOGLlKuvzU,76245,714,0,106.78571428571429
172,Derivative Tricks That Teachers Probably Don 39 t Tell You YouTube,https://www.youtube.com/watch?v=0Kf0vE5AiVc,136585,1693,416,106.9577133907596
173,Is Life Quantum Mechanical Prof Jim Al Khalili YouTube,https://www.youtube.com/watch?v=NUFHbfYG83c,79936,801,54,107.00937081659973
174,Amazon 39 s Jeff Bezos Lessons in Management at I A Gala 2017 YouTube,https://www.youtube.com/watch?v=fpDUiDQigO8,431290,4203,186,107.3661936768733
175,Big O Notations YouTube,https://www.youtube.com/watch?v=V6mKVRU1evU,595962,5638,137,108.33702963097619
176,1 Introduction to Superposition YouTube,https://www.youtube.com/watch?v=lZ3bPUKo5zc,978051,9205,179,108.35929536893418
177,1 Introduction to Superposition YouTube,https://www.youtube.com/watch?v=lZ3bPUKo5zc&amp;list=PLUl4u3cNGP61-9PEhRognw5vryrSEVLPr,978060,9205,179,108.36029248836694
178,Chapter 1 1 Mechanical Vibrations Terminologies and Definitions YouTube,https://www.youtube.com/watch?v=5zjXy6tu3p4,41883,386,0,108.50518134715026
179,Big Picture Derivatives YouTube,https://www.youtube.com/watch?v=T_I-CUOc_bk,200880,1870,24,108.81906825568798
180,Mathematics at MIT YouTube,https://www.youtube.com/watch?v=gSVHaIWIgUE,1313394,12528,485,109.05870630241634
181,Micro Unit 1 Summary Basic Economic Concepts YouTube,https://www.youtube.com/watch?v=2izx5W1FAEU,440810,4111,76,109.24659231722428
182,Java Programming YouTube,https://www.youtube.com/watch?v=WPvGqX-TXP0,3372300,32380,1542,109.35534081328231
183,Walter Lewin MIT professor quot All of you have now lost your virginity in Physics quot interview Yo,https://www.youtube.com/watch?v=sF-m3XZKvLI,462425,4265,39,109.42380501656413
