,Title,URL,Views,Likes,Dislikes,Score
179,Radiolab Laughter Amanda Aronczyk JoAnne Bachorowski Dr Jaak Panksepp YouTube,https://www.youtube.com/watch?v=9R7iByDo8sU,3051,26,0,117.34615384615384
180,Radiolab Cities Luis Bettencourt Diane Galusha Dr Robert Levine Joan Quigley Sxip Shirey YouTube,https://www.youtube.com/watch?v=HNha8P0asRY,5477,46,0,119.06521739130434
181,What Plants Talk About Full Documentary YouTube,https://www.youtube.com/watch?v=CrrSAc-vjG4,1323855,11177,340,122.16065331733874
182,Radiolab REBROADCAST Detective Stories YouTube,https://www.youtube.com/watch?v=eHazbt_wq3U,9446,77,0,122.67532467532467
183,Radiolab Parasites Dickson Despommier Dr Robert Sapolsky Fuller Torrey Pat Walters YouTube,https://www.youtube.com/watch?v=hQGjCEsIwGc,4080,33,0,123.63636363636364
184,Radiolab Haunted Dennis Conrow YouTube,https://www.youtube.com/watch?v=xy6F7BrFrf8,1484,12,0,123.66666666666667
185,Radiolab Oops Alston Chase Michael Cohen Edwin Dobb Barret Golding Ruben Gur YouTube,https://www.youtube.com/watch?v=OB1LQ7sEbG0,5198,42,0,123.76190476190476
186,Radiolab Where Am I Dr Jonathan Cole Dr Antonio Damasio Col Dan Fulgham Dr Ramachandran YouTube,https://www.youtube.com/watch?v=Elx9vnP5cHA,6380,51,0,125.09803921568627
187,Radiolab Patient Zero Updated Nolan Smith Nathan Wolfe and Carl Zimmer YouTube,https://www.youtube.com/watch?v=cdYuKNXyFVg,6320,61,11,126.4
188,Radiolab Limits Patrick Autissier Daniel Coyle Dr Elkhonon Goldberg Wendy Ingraham YouTube,https://www.youtube.com/watch?v=F3cmgjwmNEs,6504,51,0,127.52941176470588
189,Radiolab The Buried Bodies Case Frank Armani Lisa Lerman Roberta Petz and Jim Tracy YouTube,https://www.youtube.com/watch?v=1V7eNd3tuzY,5230,41,0,127.5609756097561
190,Radiolab Update Eye In the Sky Alex Goldmark and Manoush Zomorodi YouTube,https://www.youtube.com/watch?v=CCSTLAjQWc8,2565,20,0,128.25
191,Radiolab Things the Wright brother 39 s plane YouTube,https://www.youtube.com/watch?v=FKM9vhSwwJI,1812,14,0,129.42857142857142
192,Radiolab Poop Train Frederick Kaufman and Pat Walters YouTube,https://www.youtube.com/watch?v=04OpSfYyBgA,1559,12,0,129.91666666666666
193,Radiolab Juana Molina YouTube,https://www.youtube.com/watch?v=J5tWmyL0ikk,263,2,0,131.5
194,Radiolab The Fix The End of My Addiction YouTube,https://www.youtube.com/watch?v=zJ9VgVTH0FY,659,5,0,131.8
195,Radiolab The Cathedral Sruthi Pinnamaneni YouTube,https://www.youtube.com/watch?v=cREUZ3G6Aj8,1863,14,0,133.07142857142858
196,Radiolab Parasites Dickson Despommier Robert Sapolsky Fuller Torrey Pat Walters Carl Zimmer YouTube,https://www.youtube.com/watch?v=OqjTQrjp7ug,268,2,0,134.0
197,SML Movie Chef Poo Poo 39 s Kitchen Disaster YouTube,https://www.youtube.com/watch?v=j-UKToBpkF8,5530190,43052,1868,134.28006021756022
198,Radiolab Worth the public radio station YouTube,https://www.youtube.com/watch?v=9afZK5b66_g,1478,11,0,134.36363636363637
199,Radiolab The Buried Bodies Case public radio station YouTube,https://www.youtube.com/watch?v=196-qDurUBQ,1218,9,0,135.33333333333334
200,SML Movie Bowser Junior 39 s Halloween Problem YouTube,https://www.youtube.com/watch?v=m-yx5f3aPyQ,5990716,46969,2809,135.65932971014493
201,Radiolab Hello dolphins vs Lynn Levy YouTube,https://www.youtube.com/watch?v=yII0d12DDoE,1100,8,0,137.5
202,SML Movie Jeffy 39 s Special Easter YouTube,https://www.youtube.com/watch?v=8rE--9UP2sE,8830415,66575,3243,139.4305406429609
203,Radiolab Fu Manchu Ben Calhoun YouTube,https://www.youtube.com/watch?v=3EUm20I-eBY,698,5,0,139.6
204,Radiolab Are You Sure NPR YouTube,https://www.youtube.com/watch?v=fv2XoPZMphA,4107,29,0,141.6206896551724
205,Radiolab The Fact of the Matter Tim Kreider Errol Morris Merle Pribbenow Thomas D Seeley YouTube,https://www.youtube.com/watch?v=ojw-Qx2pgpg,4544,32,0,142.0
206,Radiolab Translation the public radio station YouTube,https://www.youtube.com/watch?v=1lHpaubvsfE,1718,12,0,143.16666666666666
207,Radiolab Radiolab Presents Ponzi Supernova Steve Fishman and Ellen Horne YouTube,https://www.youtube.com/watch?v=dlPSSUps5T4,6032,42,0,143.61904761904762
208,Radiolab 60 Words the public radio station YouTube,https://www.youtube.com/watch?v=n5izmzF_og4,1449,10,0,144.9
209,Radiolab Escape Edward Dolnick Ann Druyan Phil Lapsley Ben Montgomery and Merav Opher YouTube,https://www.youtube.com/watch?v=B3WvG4VcmBY,4358,30,0,145.26666666666668
210,Radiolab The Ring and I Howard Shore Playwrite Tony Kushner Joe Clark Alex Ross YouTube,https://www.youtube.com/watch?v=_bWuPNG_LmY,2037,14,0,145.5
211,Radiolab Shrink the public radio station YouTube,https://www.youtube.com/watch?v=SMlaMNtLiwM,729,5,0,145.8
212,Radiolab Shorts KILL 39 EM ALL the public radio station YouTube,https://www.youtube.com/watch?v=qSwetgMzrw4,438,3,0,146.0
213,Radiolab Null and Void Produced by Matt Kielty and Tracie Hunte YouTube,https://www.youtube.com/watch?v=3fDe3JABysw,4377,29,0,150.93103448275863
214,Radiolab Seneca Nebraska Simon Adler YouTube,https://www.youtube.com/watch?v=zadgPrlw9t0,1363,9,0,151.44444444444446
215,Radiolab Famous Tumors Christo Baars Orrin Devinsky Dr Stanley Gartler Dr George Gey YouTube,https://www.youtube.com/watch?v=ZdcF5XxO-0c,929,6,0,154.83333333333334
216,Rocky and Bullwinkle 1 Hour Compilation TV Series Full Episode Cartoon for Children xf0 x9f x90 xbf ,https://www.youtube.com/watch?v=NDAz17nO67M,55306,379,22,154.9187675070028
217,Radiolab Letting Go David Eagleman and Lulu Miller YouTube,https://www.youtube.com/watch?v=bKfefxONXto,1396,9,0,155.11111111111111
218,Radiolab Bigger Than Bacon Nancy Knowlton Todd Mainprize Dave Stein and Michel Versluis YouTube,https://www.youtube.com/watch?v=Pr6fPk1P8gI,2175,14,0,155.35714285714286
219,Radiolab Secrets of Success Malcolm Gladwell YouTube,https://www.youtube.com/watch?v=86W5600U4bA,12297,96,17,155.65822784810126
220,MARY POPPINS RETURNS Official Trailer 2018 Emily Blunt Disney Movie HD YouTube,https://www.youtube.com/watch?v=g7L1TjQS7YI,171410,1170,70,155.8272727272727
221,Radiolab Time Brian Greene Jay Griffiths Ben Rubin Dr Oliver Sacks and Rebecca Solnit YouTube,https://www.youtube.com/watch?v=eZQij5l5Wt8,19566,140,15,156.528
222,Radiolab Games the public radio station YouTube,https://www.youtube.com/watch?v=lJIq9zsyoFU,1099,7,0,157.0
223,Radiolab Space Dr Peter Diamandis Timothy Ferris Dario Robleto and Neil deGrasse Tyson YouTube,https://www.youtube.com/watch?v=hrSqGQO09YE,2846,18,0,158.11111111111111
224,Radiolab Radiolab Presents The Loneliness of the Goalkeeper YouTube,https://www.youtube.com/watch?v=_nWxJNgS5go,1130,7,0,161.42857142857142
225,Radiolab Beyond Time Brian Greene Dr Michio Kaku David McDermott Dr V S Ramachandran YouTube,https://www.youtube.com/watch?v=fB5z63v12qE,6790,42,0,161.66666666666666
226,Radiolab Radiolab Presents More Perfect The Political Thicket Suzie Lechtenberg YouTube,https://www.youtube.com/watch?v=0ONtcQDK-sc,3406,21,0,162.1904761904762
227,Radiolab Stranger in Paradise Procyon minor YouTube,https://www.youtube.com/watch?v=5Zd7l6LSEO4,2436,15,0,162.4
228,Radiolab Placebo Dr Naji Abumrad Fabrizio Benedetti preacher Steve Buza Dr Daniel Carr YouTube,https://www.youtube.com/watch?v=atpDWv2GTZE,325,2,0,162.5
229,Talk Is Jericho The Montreal Screwjob 20 Years Later YouTube,https://www.youtube.com/watch?v=-3vbkR0Q8Kk,23839,158,12,163.28082191780823
230,Radiolab Blood NPR YouTube,https://www.youtube.com/watch?v=4AAu12jAlgU,2456,15,0,163.73333333333332
231,Radiolab War of the Worlds Tony Field Richard Gerrig Jason Loviglio and Daniel Myrick YouTube,https://www.youtube.com/watch?v=mi0KdY_W0sg,1972,12,0,164.33333333333334
232,Radiolab Radiolab Presents More Perfect The Imperfect Plaintiffs the public radio station YouTube,https://www.youtube.com/watch?v=iGXH3XlnMKg,506,3,0,168.66666666666666
233,Radiolab From Tree to Shining Tree the public radio station YouTube,https://www.youtube.com/watch?v=AzDp1gNscbA,1520,9,0,168.88888888888889
234,Radiolab Presents More Perfect Kittens Kick The Giggly Blue Robot All Summer YouTube,https://www.youtube.com/watch?v=Hl10LfMaK0k,2028,12,0,169.0
235,Radiolab Diagnosis Dr Teri Brentnall Dr Mary Bronner Emanuel Frowner Cynthia Fu Louis Garcia YouTube,https://www.youtube.com/watch?v=Y3M2QoMniVM,170,1,0,170.0
236,Radiolab New Normal Dmitri Belyaev Tecumseh Fitch John Horgan Stu Rasmussen YouTube,https://www.youtube.com/watch?v=D9_1fBW_5Og,686,4,0,171.5
237,9 Hidden Secrets Disney Snuck Right By You YouTube,https://www.youtube.com/watch?v=9A4qN6PfFfE,4116906,25574,1659,172.1474388459126
238,SML Movie Jeffy 39 s Bedtime YouTube,https://www.youtube.com/watch?v=7HldQnYQ05E,12705717,77108,4914,175.9940853810566
239,Radiolab Contact YouTube,https://www.youtube.com/watch?v=on3VkCL9mwI,1080,6,0,180.0
240,BBC How Plants Communicate amp Think Amazing Nature Documentary YouTube,https://www.youtube.com/watch?v=Q-4w5xYLwiU,1829923,10664,557,181.0550113782527
241,Radiolab Race Ali Abbas Dr Jay Cohn Richard Cooper Troy Duster Tony Frudakis YouTube,https://www.youtube.com/watch?v=XG4lemJKfxc,183,1,0,183.0
242,Radiolab Birthstory the public radio station YouTube,https://www.youtube.com/watch?v=Hc55T_Mm7ZI,578,3,0,192.66666666666666
243,RadioLab Symmetry YouTube,https://www.youtube.com/watch?v=XqYGsnF-AG4,17719,91,0,194.71428571428572
244,The Looney Tunes Show it 39 s a handbag YouTube,https://www.youtube.com/watch?v=aYpJ-O974SU,88674,475,31,199.71621621621622
245,Radiolab Laughter Amanda Aronczyk JoAnne Bachorowski Dr Jaak Panksepp YouTube,https://www.youtube.com/watch?v=yAkbafBZHws,200,1,0,200.0
246,TOP UPCOMING ANIMATED MOVIES 2018 Trailer YouTube,https://www.youtube.com/watch?v=p-yIGS9eW-o,24615566,133455,10808,200.70255285494142
247,Radiolab Radiolab Presents More Perfect Object Anyway the public radio station YouTube,https://www.youtube.com/watch?v=s9nD9vkG95Y,612,3,0,204.0
248,Radiolab Radiolab Presents Invisibilia YouTube,https://www.youtube.com/watch?v=17MT4KHJSS8,4694,23,0,204.08695652173913
249,Radiolab David and the Wire David Weinberg YouTube,https://www.youtube.com/watch?v=L8IFUAxpIIM,837,4,0,209.25
250,The Looney Tunes Show semper lie YouTube,https://www.youtube.com/watch?v=v39OckU8vLk,112349,560,32,212.78219696969697
251,ANIMATION MOVIES YOU CAN NOT MISS IN 2018 Trailer YouTube,https://www.youtube.com/watch?v=8aqRLVy98hY,3247844,16319,1356,217.0583439149903
252,Sml Jeffy Try Not To Laugh YouTube,https://www.youtube.com/watch?v=R9H_OkZTj4c,7488595,36644,2829,221.45778500665386
253,The looney tunes show itsy bitsy gopher YouTube,https://www.youtube.com/watch?v=zzoWVE3WJE4,111971,527,28,224.39078156312624
254,Radiolab It 39 s Not Us It 39 s You YouTube,https://www.youtube.com/watch?v=m-jH2ooDnnI,2064,9,0,229.33333333333334
255,SML Jeffy 39 s Taco Tuesday YouTube,https://www.youtube.com/watch?v=EBe8j7I4WUY,1064970,5365,750,230.76273022751897
256,Brooke Gladstone The Trouble with Reality YouTube,https://www.youtube.com/watch?v=CAtaXVIPdJI,232,1,0,232.0
257,Alvin and the Chipmunks Best Scenes 2 YouTube,https://www.youtube.com/watch?v=MqWJS8j2UwU,6565,28,0,234.46428571428572
258,SML MOVIE The Test without filler YouTube,https://www.youtube.com/watch?v=3rOdcQlKYtU,776805,3643,515,248.33919437340154
259,Looney Tunes Classic Cartoon Compilation Best of Speedy Gonzales YouTube,https://www.youtube.com/watch?v=s0TDtX8Qqwo,226037,962,68,252.837807606264
260,Radiolab Darkode Hackers YouTube,https://www.youtube.com/watch?v=WlOFMy74C0w,1821,7,0,260.14285714285717
261,Radiolab Shorts The Skull Professor Lee Berger and Dr Chris Stringer YouTube,https://www.youtube.com/watch?v=dC6gMPrP4hI,1583,6,0,263.8333333333333
262,Aladdin First Look 2019 YouTube,https://www.youtube.com/watch?v=T5YicuQKFw0,3420081,15186,2499,269.57365807519506
263,Winnie the Pooh Movie Trailer Official HD YouTube,https://www.youtube.com/watch?v=hRT86ZggCEk,3730992,13957,563,278.5569658055846
264,The BIGGEST POPEYE THE SAILOR MAN COMPILATION Popeye Bluto and more Cartoons for Children HD YouTube,https://www.youtube.com/watch?v=YvM9myyWGRw,2288183,9003,884,281.83064416800096
265,Coco 2017 Best Scenes The Story Miguel H xc3 xa9ctor Is Great Great Grandfather amp Happy Ending You,https://www.youtube.com/watch?v=KP7CqJ6D8gI,4107988,16074,1755,286.89070465814655
266,Radiolab Buttons Not Buttons Radiolab Podcast Articles YouTube,https://www.youtube.com/watch?v=s3ElPtOTYP0,1442,5,0,288.4
267,LOONEY TUNES BEST OF YOSEMITE SAM 30 MINUTES OF CARTOONS YouTube,https://www.youtube.com/watch?v=jM1Faekyzj8,192134,748,91,292.441400304414
268,Radiolab Bigger Little Questions Gabriel Barrie Peter Barry Arne Hendriks Tom McCollom YouTube,https://www.youtube.com/watch?v=OfsrI7sZdOc,307,1,0,307.0
269,Radiolab Deception Gordon Burghardt Paul Ekman Ruben Gur Barry L McManus Harold Sackeim YouTube,https://www.youtube.com/watch?v=7G-JyW5MWdw,661,2,0,330.5
270,LOONEY TUNES CARTOONS COMPILATION ULTRA HD 4K Bugs Bunny Daffy Duck and more for Children YouTube,https://www.youtube.com/watch?v=cUsvKvfpdNA,614801,1981,212,347.54154889768233
271,LOONEY TUNES Looney Toons BEST COMPILATION Bugs Bunny Daffy Duck Porky Pig HD 4K YouTube,https://www.youtube.com/watch?v=EcIpupZ8v6g,1131905,3748,500,348.49291871921184
272,The BIGGEST LOONEY TUNES COMPILATION Bugs Bunny Daffy Duck and more Cartoons for Children HD YouTube,https://www.youtube.com/watch?v=OM6xvpzqCUA,19356865,59144,8176,379.7846688118035
273,Radiolab I Don 39 t Have To Answer That the public radio station YouTube,https://www.youtube.com/watch?v=WrtXSALBZTo,397,1,0,397.0
274,Radiolab One Vote Carole Bucy C P Joshi Hemlata Joshi Jill Lepore Alan Lesselyong YouTube,https://www.youtube.com/watch?v=kGUqS3xixXU,11523,28,0,411.5357142857143
275,Woody Woodpecker Show Chicken Woody Full Episode Cartoons For Children YouTube,https://www.youtube.com/watch?v=z55S0s5_8rk,1326239,4178,1023,420.3610142630745
276,The BEST BUGS BUNNY DAFFY DUCK amp PORKY PIG Looney Tunes Merrie Melodies Cartoons For Children HD Y,https://www.youtube.com/watch?v=ITEXG22Y0MY,4358800,11848,1711,429.9891486633126
277,TOP 10 BEST CLASSIC LOONEY TUNES CARTOONS OF ALL TIME COMPILATION Cartoons for Children HD YouTube,https://www.youtube.com/watch?v=WDmNwyVNqHE,6915769,18169,2322,436.4087208935445
278,Radiolab Alpha Gal the public radio station YouTube,https://www.youtube.com/watch?v=WikbQbsS4N8,459,1,0,459.0
279,Looney Tunes Wile E Coyote Genius Extraordinaire 30 Minutes YouTube,https://www.youtube.com/watch?v=4NGA1cLWqzQ,670638,1586,253,503.10427606901726
280,Radiolab The Girl Who Doesn 39 t Exist the public radio station YouTube,https://www.youtube.com/watch?v=aCYDTYZD6Yk,509,1,0,509.0
281,Woody Woodpecker Show 1 Hour Compilation Cartoons For Children YouTube,https://www.youtube.com/watch?v=Q4uIdPOpen8,4036689,9587,1979,530.5847791798108
282,DAFFY DUCK Looney Tunes Cartoons Compilation xe2 x96 xba Best Of Looney Toons Cartoons For Kids HD 1,https://www.youtube.com/watch?v=2n7UgwWGUeQ,2388020,4725,757,601.8195564516129
283,Zootopia Funny moments YouTube,https://www.youtube.com/watch?v=FNnnloQ72xc,7018081,14362,2938,614.3278186274509
284,Tom amp Jerry Classic Cartoon Compilation Tom Jerry amp Spike YouTube,https://www.youtube.com/watch?v=cqyziA30whE,4245720,10019,3137,616.9311246730601
285,Radiolab Shorts The Distance of the Moon Italo Calvino and Liev Schreiber YouTube,https://www.youtube.com/watch?v=x7-csr71Ww4,639,1,0,639.0
286,Tom amp Jerry Classic Cartoon Compilation Best of Tuffy YouTube,https://www.youtube.com/watch?v=tKwD-0lFe4c,3296946,6960,2164,687.4366138448707
287,THE BOSS BABY All Movie Clips Trailer 2017 YouTube,https://www.youtube.com/watch?v=Cimp-eTe3MU,100029739,180442,44225,734.3410807755273
288,Radiolab Los Frikis the public radio station YouTube,https://www.youtube.com/watch?v=2DpPHe6nAL8,762,1,0,762.0
289,Zootopia 2016 Best Scenes YouTube,https://www.youtube.com/watch?v=b4edGHH9Hok,4571452,8198,2266,770.6426163182738
290,The Land Before Time Full Episodes The Mysterious Tooth Crisis 104 Cartoon for Kids YouTube,https://www.youtube.com/watch?v=ywMoskVD8Ss,1949383,3432,931,779.4414234306278
291,Shaun The Sheep Full Episodes Shaun The Sheep Cartoons Best New Collection About 1 Hour 1 YouTube,https://www.youtube.com/watch?v=t-bsG_lGVfs,1088074,1477,493,1105.7662601626016
292,Donald Duck Cartoon Compilation HD 2 Hours YouTube,https://www.youtube.com/watch?v=Y4wQcxMbSq8,1156739,1423,407,1138.5226377952756
293,SING BEST Video Clips amp Trailers 2017 Animation Kids Movie HD YouTube,https://www.youtube.com/watch?v=1_2HurMbwLA,56290442,68218,24802,1296.5368067072047
294,Spongebob Patrick Play doh STOP MOTION playdo video Bob Esponja Stopmotion YouTube,https://www.youtube.com/watch?v=YnltFSl_DQ0,322567299,354878,131234,1442.3248511026452
295, xd0 x9c xd0 xb0 xd1 x88 xd0 xb0 xd0 xb8 xd0 x9c xd0 xb5 xd0 xb4 xd0 xb2 xd0 xb5 xd0 xb4 xd1 x8c Mas,https://www.youtube.com/watch?v=KYniUCGPGLs,2911625987,3273786,1821674,2005.0973940026665
296,Toy Story 4 Trailer 1 June 16 2019 YouTube,https://www.youtube.com/watch?v=QW0sjQFpXTU,12038313,26266,23084,3783.2536140791954
297,The Lion King Teaser Trailer 2019 Movie HD YouTube,https://www.youtube.com/watch?v=qev9SUGx1f4,538751,1,0,538751.0
298,SML Movie The Test SupermarioLogan SML Movie YouTube,https://www.youtube.com/watch?v=n8ubERtz9Q0,1405177,1,0,1405177.0
299,SML Movie Jeffy 39 s Pet SupermarioLogan SML Movie YouTube,https://www.youtube.com/watch?v=FTP3yZ0IrxI,4739803,1,0,4739803.0
