,Title,URL,Views,Likes,Dislikes,Score
0, xef xbc xa3 xef xbc xa8 xef xbc xa9 xef xbc xac xef xbc xac xe3 x80 x80 xef xbc xb2 xef xbc xa1 xef,https://www.youtube.com/watch?v=8f3tfSSiIWk,1,27938,567,3.653501881553469e-05
1,Slime ASMR Most Satisfying Slime Video Crunchy Slime Iceberg Slime Jiggly Slime Rainbow Slime YouTub,https://www.youtube.com/watch?v=o3wfELIToFc,1,12198,1619,9.452689290103034e-05
2,MarI O AI playing Super Mario Bros YouTube,https://www.youtube.com/watch?v=iU4mf4lECZ0,1,835,121,0.0014005602240896359
3,Percentage Quiz For SBI CLERK IBPS SSC CHSL SSC CPO RRB ALP Group D Maths YouTube,https://www.youtube.com/watch?v=OpxAvTBV1a0,1,178,0,0.0056179775280898875
4, xe0 xa4 xac xe0 xa4 xbe xe0 xa4 x9c xe0 xa4 xbe xe0 xa4 xb0 xe0 xa4 x94 xe0 xa4 xb0 xe0 xa4 x97 xe0,https://www.youtube.com/watch?v=Meg4p0ph4Uo,1,141,18,0.008130081300813009
5,ANJUMAN TROPHY 2018 PRINCE MOVIES FINAL DAY YouTube,https://www.youtube.com/watch?v=hMXXdpCtQRs,1,82,13,0.014492753623188406
6,BREKETE FAMILY PROGRAMME FOR 9TH MARCH 2018 YouTube,https://www.youtube.com/watch?v=-q19s5nOFaU,1,14,0,0.07142857142857142
7,Radiolab Lost amp Found Lera Boroditsky Emilie Gossiaux Dr Giuseppe Iaria Karen Jacobsen YouTube,https://www.youtube.com/watch?v=W8-FdhA8aVI,60,3,0,20.0
8,SML Movie Cody 39 s 10th Birthday YouTube,https://www.youtube.com/watch?v=frjE3QzOsAA,487023,23183,403,21.379411764705882
9,Radiolab Radiolab Presents More Perfect Kittens Kick The Giggly Blue Robot All Summer YouTube,https://www.youtube.com/watch?v=N3qGPDB5zoM,193,9,0,21.444444444444443
10,Radiolab Secrets of Success Malcolm Gladwell YouTube,https://www.youtube.com/watch?v=CONFPulyq0I,179,8,0,22.375
11,Radiolab Words Charles Fernyhough Susan Schaller Ann Senghas James Shapiro YouTube,https://www.youtube.com/watch?v=__XjyUTwCQs,108,4,0,27.0
12,The Messed Up Origins of Winnie the Pooh Disney Explained Jon Solo YouTube,https://www.youtube.com/watch?v=mBIF64Cf99s,277904,10314,447,28.16499442586399
13,Radiolab Words Will Never Hurt Me Adam Gopnik YouTube,https://www.youtube.com/watch?v=YfKn9hR4p6M,402,13,0,30.923076923076923
14,Wreck It Ralph Vanellope Von Schweetz Transformation Makeup Tutorial YouTube,https://www.youtube.com/watch?v=VSDa9u453gs,8639635,254440,4131,34.515878374329326
15,Radiolab Seeing In Tongues Emilie Gossiaux YouTube,https://www.youtube.com/watch?v=OzPJBf2UbOw,436,12,0,36.333333333333336
16,Radiolab Radiolab Presents More Perfect The Political Thicket YouTube,https://www.youtube.com/watch?v=hi8NCQbOZvc,453,12,0,37.75
17,Radiolab Radiolab Presents More Perfect More Perfect presents Adoptive Couple v Baby Girl YouTube,https://www.youtube.com/watch?v=mZQXMYwOB8I,423,11,0,38.45454545454545
18,Logan Reacts Mario The Babysitter YouTube,https://www.youtube.com/watch?v=RVaJBH7flvc,578089,14711,324,40.181344269131856
19,Radiolab Strangers in the Mirror Oliver Sacks and Chuck Close YouTube,https://www.youtube.com/watch?v=kojZNKkJ6cM,125,3,0,41.666666666666664
20,Radiolab 100 Flowers Douglas Hofstadter YouTube,https://www.youtube.com/watch?v=NofTsM93ycY,674,16,0,42.125
21,Radiolab Eagle Eyes David Eagleman YouTube,https://www.youtube.com/watch?v=fr4OMEJ-s2w,381,9,0,42.333333333333336
22,JEFFY xe2 x80 x99S FIRST VLOG YouTube,https://www.youtube.com/watch?v=TQl2K9yCKOk,468080,11933,1019,42.88803371816016
23,Many Adventures of Winnie the Pooh Disneycember YouTube,https://www.youtube.com/watch?v=WAeXAJoKoFo,117617,2738,22,43.30522827687776
24,Radiolab Home Is Where Your Dolphin Is D Graham Burnett YouTube,https://www.youtube.com/watch?v=FFOsdK0vvpI,483,11,0,43.90909090909091
25,Jim Cummings and the Ultimate Disney Voice Off YouTube,https://www.youtube.com/watch?v=WoNFgUjSBTE,314683,7185,52,44.11650077106407
26,Radiolab Ghosts of Football Future Chuck Klosterman Soren Wheeler and Molly Webster YouTube,https://www.youtube.com/watch?v=styefS8-AS4,401,9,0,44.55555555555556
27,Radiolab Smarty Plants Aatish Bhatia Jennifer Frazer Monica Gagliano Lincoln Taiz Alvin Ubell YouTub,https://www.youtube.com/watch?v=_w7MHmebvrM,4126,91,0,45.34065934065934
28,Radiolab Carbon Bruce Buchholz Jonas Fris xc3 xa9n and Kirsty Spalding YouTube,https://www.youtube.com/watch?v=Xj_2fCmGrlo,820,18,0,45.55555555555556
29,Christopher Robin Official Teaser Trailer YouTube,https://www.youtube.com/watch?v=425M4M3Opkk,5516851,125591,4715,45.64058208411926
30,Radiolab Serious Gregory Warner YouTube,https://www.youtube.com/watch?v=OJnqn1ilcRs,504,11,0,45.81818181818182
31,Radiolab The Real Don Quixote YouTube,https://www.youtube.com/watch?v=tEHvBEW-8VA,734,16,0,45.875
32,SML Movie Jeffy 39 s Clone YouTube,https://www.youtube.com/watch?v=P5X8ib_fHAw,6822675,153806,5812,46.101024365852666
33,Radiolab Update New Stu Aaron Scott YouTube,https://www.youtube.com/watch?v=6OzcagX-Ejs,385,8,0,48.125
34,Logan Reacts Forsaken YouTube,https://www.youtube.com/watch?v=ZHhibY79SpM,524815,11090,221,48.28549084552397
35,Radiolab The Heartbeat Summer Ash YouTube,https://www.youtube.com/watch?v=nHUwn30EXxE,591,12,0,49.25
36,Radiolab What Do Dolphins Talk About Denise Herzing and Thad Starner YouTube,https://www.youtube.com/watch?v=7JtrC4JPJZo,995,20,0,49.75
37,Marvel Studios 39 Avengers Infinity War Official Trailer YouTube,https://www.youtube.com/watch?v=6ZfuNTqbHE8,147926766,3011199,66515,50.23519195947681
38,Being Human Robert Sapolsky YouTube,https://www.youtube.com/watch?v=TnlZwfD-GiU,38810,784,12,50.2720207253886
39,Radiolab In The Dust Of This Planet Horror fashion and the end of the world xe2 x80 xa6 YouTube,https://www.youtube.com/watch?v=MU2pDstIGwY,3455,67,0,51.56716417910448
40,Radiolab Object Lesson Alison Gopnik YouTube,https://www.youtube.com/watch?v=neqAMSz9pbk,570,11,0,51.81818181818182
41,Radiolab Blisshrooms Roland Griffiths YouTube,https://www.youtube.com/watch?v=GjewMtLsh5A,2489,47,0,52.95744680851064
42,Radiolab So Called Life Brian Baynes George Church Nigel Goldenfeld Karen Keegan YouTube,https://www.youtube.com/watch?v=ItD20LClB3g,214,4,0,53.5
43,Radiolab The Montreal Screwjob YouTube,https://www.youtube.com/watch?v=eqcHo5za2Ek,917,17,0,53.94117647058823
44,Radiolab The Seed Jar Craig Childs Regan Choi and Dirk Vaughan YouTube,https://www.youtube.com/watch?v=Kg_fF2blJ1k,1242,23,0,54.0
45,Radiolab Radiolab Presents More Perfect The Gun Show YouTube,https://www.youtube.com/watch?v=YKTaIY_Qbsk,2054,38,0,54.05263157894737
46,Radiolab Dear Hector Bianca Giaever YouTube,https://www.youtube.com/watch?v=ryvEtmzq8FM,923,17,0,54.294117647058826
47,Radiolab Why are bad guys bad Jeff Jensen and James Shapiro YouTube,https://www.youtube.com/watch?v=_8Dncmy7uZ8,1261,23,0,54.82608695652174
48,Radiolab Update New Baboon Dr Robert Sapolsky YouTube,https://www.youtube.com/watch?v=6fIDxRX8shQ,885,16,0,55.3125
49,Radiolab Ghosts of Football Past Sally Jenkins Dr Conrad Crane and Dr Eric Anderson YouTube,https://www.youtube.com/watch?v=JXJEutbTS6I,455,8,0,56.875
50,Radiolab Gut Feelings John Cryan Jonah Lehrer and Carl Zimmer YouTube,https://www.youtube.com/watch?v=RuctfXH_W84,1563,27,0,57.888888888888886
51,How King Candy Took Over Sugar Rush Wreck It Ralph Theory Discovering Disney YouTube,https://www.youtube.com/watch?v=bcM4JfqlZnA,208101,3616,149,60.023363138159795
52,Radiolab The Golden Rule Nick Corrigan Ibrahim Hussein and Andy Rowe YouTube,https://www.youtube.com/watch?v=OeYObQg-LJM,1772,29,0,61.10344827586207
53,Radiolab To The Brink Tim Howard Linda Cayot Karl Campbell and Josh Donlan YouTube,https://www.youtube.com/watch?v=Nli6Qf5-NfQ,1106,18,0,61.44444444444444
54,Radiolab Oliver Sacks A Journey From Where to Where Billy Hayes and Dr Oliver Sacks YouTube,https://www.youtube.com/watch?v=REUHsUjXUpc,1672,27,0,61.925925925925924
55, REMOVED Radiolab The Truth Trolls YouTube,https://www.youtube.com/watch?v=ttjX3e1qo-s,991,16,0,61.9375
56,Radiolab Cities Luis Bettencourt Diane Galusha Dr Robert Levine Joan Quigley Sxip Shirey YouTube,https://www.youtube.com/watch?v=8IEkH4-yEiE,62,1,0,62.0
57,Radiolab Radiolab Presents More Perfect Cruel and Unusual YouTube,https://www.youtube.com/watch?v=aSe8f-fWmdg,815,13,0,62.69230769230769
58,Behave by Robert Sapolsky PhD Enhanced audio YouTube,https://www.youtube.com/watch?v=pGJD0P2r8YQ,20078,318,0,63.138364779874216
59,High School Musical 4 2018 Teaser Trailer 1 Concept Disney Musical Movie HD YouTube,https://www.youtube.com/watch?v=K5fcqaeDxaM,9627695,157840,5798,63.322601649544204
60,Radiolab What Does Technology Want Steven Johnson and Kevin Kelly YouTube,https://www.youtube.com/watch?v=E17DgzCc-D4,127,2,0,63.5
61,Radiolab Is There an Edge to the Heavens Edward Dolnick Ann Druyan and Merav Opher YouTube,https://www.youtube.com/watch?v=aKo4RTkoJ7s,2455,38,0,64.60526315789474
62,Radiolab Growing Up is Awfuler than All the Awful things that Ever Were YouTube,https://www.youtube.com/watch?v=VVb4BIH-Ecg,908,14,0,64.85714285714286
63,Radiolab K poparazzi the public radio station YouTube,https://www.youtube.com/watch?v=3_EAdUOBvoM,132,2,0,66.0
64,Radiolab Blood Buddies Professor Gerald S Wilkinson YouTube,https://www.youtube.com/watch?v=TVrApnMes6U,662,10,0,66.2
65,SML Movie The Competition YouTube,https://www.youtube.com/watch?v=eFv-WT8bEGw,6851843,106260,4794,67.52846273628604
66,Radiolab Words that Change the World Charles Fernyhough Susan Schaller James Shapiro YouTube,https://www.youtube.com/watch?v=L_8ANMb9SOY,1150,17,0,67.6470588235294
67,Disney 39 s The Nutcracker and the Four Realms Teaser Trailer YouTube,https://www.youtube.com/watch?v=2ktuvx9hrMw,4794990,73255,2957,68.2094796438021
68,Radiolab In Silence YouTube,https://www.youtube.com/watch?v=obT1JP9LR3s,2320,34,0,68.23529411764706
69,TT Movie Sonic Goes To Sonic YouTube,https://www.youtube.com/watch?v=BLZ2vU7i6uE,936164,14273,673,68.83558823529411
70,Radiolab Fu Manchu YouTube,https://www.youtube.com/watch?v=Bwra3wwpatA,69,1,0,69.0
71,Pixar Geri 39 s Game ORIGINAL AUDIO YouTube,https://www.youtube.com/watch?v=gLQG3sORAJQ,2105985,31265,873,69.29405764674914
72,Radiolab In Defense of Darwin Richard Dawkins YouTube,https://www.youtube.com/watch?v=RefVREI9fe8,835,12,0,69.58333333333333
73,Ralph Breaks The Internet Wreck It Ralph 2 Official Teaser Trailer YouTube,https://www.youtube.com/watch?v=DIBw9dSVKdU,18998523,283607,13294,70.28342329077773
74,Radiolab New Nice Brian Hare and Richard Wrangham YouTube,https://www.youtube.com/watch?v=it-0fXtUrtI,637,9,0,70.77777777777777
75,Radiolab Dr Sacks Looks Back Dr Oliver Sacks YouTube,https://www.youtube.com/watch?v=Yufv9IhlArY,573,8,0,71.625
76,Robert Sapolsky on science morality religion and human behavioral biology Vert Dider 2017 YouTube,https://www.youtube.com/watch?v=VrQkl7PaA1s,50893,730,32,72.91260744985674
77, quot Behave quot by Robert Sapolsky PhD YouTube,https://www.youtube.com/watch?v=k5rUwupQSQY,19997,272,0,73.51838235294117
78,Radiolab How to Be a Hero Walter F Rutkowski and Dr Robert Sapolsky YouTube,https://www.youtube.com/watch?v=rcbiR-p8inE,1563,21,0,74.42857142857143
79,Wreck It Ralph 2 Easter Eggs amp Hidden Secrets Ralph Breaks The Internet Teaser Trailer YouTube,https://www.youtube.com/watch?v=7Ij34aKPsNc,37693,518,13,74.63960396039604
80,Radiolab Juicervose Autism YouTube,https://www.youtube.com/watch?v=kHC6KZPz9gY,676,9,0,75.11111111111111
81,CHRISTOPHER ROBIN Official Trailer 2018 Disney Live Action Winnie The Pooh Movie HD YouTube,https://www.youtube.com/watch?v=ux87Gk1cfko,327095,4456,134,75.68139750115687
82,Radiolab In Real Time YouTube,https://www.youtube.com/watch?v=mVBj_JSZ9mg,835,11,0,75.9090909090909
83,Radiolab The Good Show Robert Axelrod Richard Dawkins Oren Harman Walter F Rutkowski YouTube,https://www.youtube.com/watch?v=bcF6Fg875ZA,77,1,0,77.0
84,Radiolab Radiolab Presents More Perfect One Nation Under Money YouTube,https://www.youtube.com/watch?v=F7AY3hxO5Ls,1619,21,0,77.0952380952381
85,Radiolab Zoos Nell Boyce Reporter Jocelyn Ford Elizabeth Gould David Hancocks YouTube,https://www.youtube.com/watch?v=LtrW92HKA5U,2939,38,0,77.34210526315789
86,WRECK IT RALPH 2 Ralph Breaks The Internet Official Trailer 2018 YouTube,https://www.youtube.com/watch?v=WIaxCo188Eo,854226,11331,372,77.94744045989597
87,Radiolab Yellow Fluff and Other Curious Encounters Erica Carmel Jerry Coyne Paul Davies YouTube,https://www.youtube.com/watch?v=Y84yNM1eBjg,157,2,0,78.5
88,Radiolab Wake Up and Dream Steve Volk YouTube,https://www.youtube.com/watch?v=tdO6eDj3_g0,1737,22,0,78.95454545454545
89,Radiolab Bringing Gamma Back Alzheimer xe2 x80 x99s disease YouTube,https://www.youtube.com/watch?v=T2eCMb_g7L4,1501,19,0,79.0
90,Radiolab I haven 39 t been myself lately Dr Robert Sapolsky YouTube,https://www.youtube.com/watch?v=tyUfj3YK5g8,952,12,0,79.33333333333333
91,Radiolab The Curious Case of the Russian Flash Mob at the West Palm Beach Cheesecake Factory YouTube,https://www.youtube.com/watch?v=Cs8jjGJ0X7g,1669,21,0,79.47619047619048
92,Radiolab How Do You Put a Price Tag On Nature YouTube,https://www.youtube.com/watch?v=K6fUnBd75X0,879,11,0,79.9090909090909
93,Radiolab Black Box the public radio station YouTube,https://www.youtube.com/watch?v=f136k5qvdzc,1439,18,0,79.94444444444444
94,Radiolab Are You My Brain Double Joy Hirsch PhD Zoe Keating and Lauren Silbert YouTube,https://www.youtube.com/watch?v=A8D0LhOqWCA,1225,15,0,81.66666666666667
95,Radiolab How Much Would You Pay For A Year Of Life YouTube,https://www.youtube.com/watch?v=lZbQFgn6Qr4,1490,18,0,82.77777777777777
96,Radiolab Cosmic Habituation Jonah Lehrer and Dr Jonathan Schooler YouTube,https://www.youtube.com/watch?v=FJEE6mKDchM,914,11,0,83.0909090909091
97,SML Movie Jeffy 39 s Nightmare YouTube,https://www.youtube.com/watch?v=3wYeDIQCRD8,10310614,128945,6139,83.95855251372083
98,This American Life 635 Chip in My Brain YouTube,https://www.youtube.com/watch?v=3iZAQaUbAVA,1260,15,0,84.0
99,Radiolab Words Charles Fernyhough Susan Schaller Ann Senghas James Shapiro Elizabeth Spelke YouTube,https://www.youtube.com/watch?v=CpXjdyz5ZFo,6080,72,0,84.44444444444444
100,Radiolab The Bus Stop Lulu Miller YouTube,https://www.youtube.com/watch?v=LMRCTJbMjnQ,762,9,0,84.66666666666667
101,Radiolab Lithium Jaime Lowe YouTube,https://www.youtube.com/watch?v=G5Af6wiGkP8,1211,14,0,86.5
102,Radiolab Radiolab Presents More Perfect Mr Graham and the Reasonable Man YouTube,https://www.youtube.com/watch?v=tcogZeXC3xw,2520,29,0,86.89655172413794
103,Robert Krulwich RadioLab The Wonder of Storytelling YouTube,https://www.youtube.com/watch?v=2NECa0AAn2U,15131,173,0,87.46242774566474
104,Radiolab On the Edge the public radio station YouTube,https://www.youtube.com/watch?v=j9DSJsXN3I4,353,4,0,88.25
105,SML Movie Jeffy 39 s Wifi Problem YouTube,https://www.youtube.com/watch?v=_mCUuc18BsI,10878563,128850,7192,89.41921616334314
106,Radiolab The Bad Show Dr David Buss Dan Charles Alex Haslam Jeff Jensen Frederick Kaufman YouTube,https://www.youtube.com/watch?v=PGwD5PPxWbk,6456,72,0,89.66666666666667
107,20 Disney Live Action Remakes Announced YouTube,https://www.youtube.com/watch?v=Srm5zun6Gik,1714708,19926,922,90.22879393811829
108,Radiolab Ghosts of Football Past Barbara Landis David Adams Eric Anderson Dr Conrad Crane YouTube,https://www.youtube.com/watch?v=B-PCrZhtQ5U,634,7,0,90.57142857142857
109,Radiolab Breaking News Matthew Aylett Nick Bilton Hany Farid Durin Gleaves Ira Kemelmacher YouTube,https://www.youtube.com/watch?v=DAdQXOcSJ5g,1636,18,0,90.88888888888889
110,Radiolab The Curious Case of the Russian Flash Mob at the West Palm Beach Cheesecake Factory YouTube,https://www.youtube.com/watch?v=8QxhZNQltA0,91,1,0,91.0
111,Radiolab The Rhino Hunter Corey Knowlton and Richard Leakey YouTube,https://www.youtube.com/watch?v=4zgEJeFs6ls,3592,39,0,92.1025641025641
112,Radiolab The Bitter End Sean Cole Joseph J Gallo MD MPH and Ken Murray MD YouTube,https://www.youtube.com/watch?v=tlFXwiNiS64,1953,21,0,93.0
113,Radiolab Oliver Sipple Daryl Lembke Daniel Luzer Ken Maley Sarah Jane Moore Dan Morain YouTube,https://www.youtube.com/watch?v=lkLy2P3_Q1g,3733,40,0,93.325
114,Radiolab An Ice Cold Case Aaron Birk Jim Dickson Andy Mills and Albert Zinc YouTube,https://www.youtube.com/watch?v=7YPdO0JxISA,1775,19,0,93.42105263157895
115,Radiolab How Much Does It Cost to Say quot I 39 m Sorry quot YouTube,https://www.youtube.com/watch?v=zGORcqKSRog,1028,11,0,93.45454545454545
116,Radiolab Bringing Gamma Back Anthony J Martorell Dheeraj S Roy and Li Huei Tsai YouTube,https://www.youtube.com/watch?v=VlBEaVIwxWw,1123,12,0,93.58333333333333
117,Radiolab Pass the Science Richard Holmes YouTube,https://www.youtube.com/watch?v=sH8hXVH534s,468,5,0,93.6
118,Radiolab After Life Ken Baldwin Paul Broks David Eagleman Gary Greenberg Adrian Owen YouTube,https://www.youtube.com/watch?v=e4IRTCfS9ss,94,1,0,94.0
119,Radiolab Killing Babies Saving the World Josh Greene YouTube,https://www.youtube.com/watch?v=aH6EtmauNrw,945,10,0,94.5
120,Incredibles 2 Olympics Sneak Peek YouTube,https://www.youtube.com/watch?v=YBpdL9hSac4,41244150,457709,22081,94.67745415813492
121,INCREDIBLES 2 Official Trailer 2018 Animation Superhero Team Movie HD YouTube,https://www.youtube.com/watch?v=c8GELmpvzuk,1015581,11505,791,94.79008773567296
122,Radiolab Memory and Forgetting Painter Joe Andoe Andrei Codrescu Joe LeDoux Jonah Lehrer YouTube,https://www.youtube.com/watch?v=48EAJpDKzfU,9109,96,0,94.88541666666667
123,Radiolab Desperately Seeking Symmetry with Neil deGrasse Tyson YouTube,https://www.youtube.com/watch?v=eIWRNotWjGs,3238,34,0,95.23529411764706
124,Radiolab Take a deep breath hold it now exhale Dr Kamran Fallahpour YouTube,https://www.youtube.com/watch?v=vVIizRMMqhw,1240,13,0,95.38461538461539
125,Why Vanellope Still Glitches Wreck It Ralph Theory Discovering Disney YouTube,https://www.youtube.com/watch?v=Daik1hc4Bdw,3100855,33994,1700,96.01953923329411
126,Radiolab Talking to Machines Freedom Baird Rollo Carpenter Brian Christian Caleb Chung YouTube,https://www.youtube.com/watch?v=nL2WSe_3jbo,4423,46,0,96.15217391304348
127,Radiolab Rodney Versus Death Amy Gilbert Tim Howard Monica Murphy Dr Sergio Recuenco Bill Wasik YouT,https://www.youtube.com/watch?v=MJxYLslEFAQ,2414,25,0,96.56
128,Radiolab Choice John Bargh Antoine Bechara Malcolm Gladwell Steven Johnson Jonah Lehrer YouTube,https://www.youtube.com/watch?v=nVYNXzgF2uo,8060,83,0,97.10843373493977
129,Radiolab Help What do you do when your own worst enemy is you YouTube,https://www.youtube.com/watch?v=510UCUrYr2E,10207,105,0,97.20952380952382
130,Radiolab The Gondolier Kristen Clark and David Conrad YouTube,https://www.youtube.com/watch?v=8oqO4-Rewn4,2936,30,0,97.86666666666666
131,Radiolab Famous Tumors Christo Baars Orrin Devinsky Dr Stanley Gartler Dr George Gey YouTube,https://www.youtube.com/watch?v=OgJYi6GYv1k,98,1,0,98.0
132,Radiolab The Good Show Robert Axelrod Richard Dawkins Oren Harman Walter F Rutkowski YouTube,https://www.youtube.com/watch?v=72MKzaZJlkg,4223,43,0,98.20930232558139
133,Radiolab Fu Go Peter Lang Stanton and Nick Farago YouTube,https://www.youtube.com/watch?v=lrvDsDwcQGU,1877,19,0,98.78947368421052
134,Radiolab Driverless Dilemma Nick Bilton Joshua Greene Raj Rajkumar and Michael Taylor YouTube,https://www.youtube.com/watch?v=8wQznN-emNI,3462,35,0,98.91428571428571
135,Radiolab Detective Stories Erick Gordon Dirk Obbink Chris Tyler Smith and Tatiana Zerjal YouTube,https://www.youtube.com/watch?v=QYvKLig6h6w,595,6,0,99.16666666666667
136,Radiolab Placebo Dr Naji Abumrad Fabrizio Benedetti preacher Steve Buza Dr Daniel Carr YouTube,https://www.youtube.com/watch?v=tN971uRydj8,3969,40,0,99.225
137,Radiolab It 39 s Not About You Tim Ferris Brian Greene and Neil deGrasse Tyson YouTube,https://www.youtube.com/watch?v=jMwwl13Qu2I,3704,37,0,100.10810810810811
138,Radiolab Staph Retreat a 1000 year old secret YouTube,https://www.youtube.com/watch?v=BJS3mkG-rZY,1202,12,0,100.16666666666667
139,Radiolab The Times They Are a Changin 39 Chris Impey Paul Mayer Neil Shubin Neil deGrasse Tyson YouT,https://www.youtube.com/watch?v=HpPnZRKmNkY,1515,15,0,101.0
140,Top 10 Disney Plot Twists You Didn 39 t See Coming YouTube,https://www.youtube.com/watch?v=LpTu5T9pRoE,2144763,23001,1843,101.36889119954627
141,Radiolab People Who Lie Yaling Yang YouTube,https://www.youtube.com/watch?v=rmUEi_eIcZc,5292,52,0,101.76923076923077
142,Radiolab So Called Life Brian Baynes George Church Nigel Goldenfeld Karen Keegan YouTube,https://www.youtube.com/watch?v=nJsGNnQAqKk,3165,31,0,102.09677419354838
143,Radiolab Race Ali Abbas Dr Jay Cohn Richard Cooper Troy Duster Tony Frudakis YouTube,https://www.youtube.com/watch?v=Ie5J5Ez93G0,5823,57,0,102.15789473684211
144,Radiolab The Multi Universe s Robert Krulwich and Brian Greene YouTube,https://www.youtube.com/watch?v=mPgTyRezp94,12996,127,0,102.33070866141732
145,Radiolab Gravitational Anarchy David Quammen and Neil deGrasse Tyson YouTube,https://www.youtube.com/watch?v=xqgKy0G7mJA,103,1,0,103.0
146,Radiolab Sperm Tim Birkhead Matthew Cobb Ari Daniel Joanna Ellington Nell Greenfieldboyce YouTube,https://www.youtube.com/watch?v=VYCJsVVPfrA,2268,22,0,103.0909090909091
147,Radiolab The Trust Engineers about Facebook YouTube,https://www.youtube.com/watch?v=nEBRa3NDbm8,2691,26,0,103.5
148,Radiolab Radiolab Presents More Perfect American Pendulum I YouTube,https://www.youtube.com/watch?v=mgwlTj-HRvk,519,5,0,103.8
149,Radiolab Cut and Run David Epstein Mr John Manners and Gregory Warner YouTube,https://www.youtube.com/watch?v=fzgyE0N1wVg,1044,10,0,104.4
150,Radiolab Speed Mike Beller Joshua Foer Seth Horowitz Eric Hunsader John Mainstone YouTube,https://www.youtube.com/watch?v=Czv_CUD118I,3455,33,0,104.6969696969697
151,Radiolab Eye in the Sky Ross McNutt YouTube,https://www.youtube.com/watch?v=3PpaPyhcHFc,211,2,0,105.5
152,SML Movie Jeffy 39 s Parents YouTube,https://www.youtube.com/watch?v=h1iAdAGtCHY,25403427,249695,11948,106.85067319461444
153,Radiolab Numbers Amanda Aronczyk Frank Benford Susan Carey Stanislas Dehaene YouTube,https://www.youtube.com/watch?v=pS61VakEdoo,2565,24,0,106.875
154,Radiolab The Universe Knows My Name Paul Auster and Michael Barrier YouTube,https://www.youtube.com/watch?v=G8uyhye6IgM,1604,15,0,106.93333333333334
155,Radiolab Diagnosis Dr Teri Brentnall Dr Mary Bronner Emanuel Frowner Cynthia Fu YouTube,https://www.youtube.com/watch?v=_vXtC8DL9W0,1930,18,0,107.22222222222223
156,Radiolab What 39 s Left When You 39 re Right the public radio station YouTube,https://www.youtube.com/watch?v=HERjFitZJyo,3223,30,0,107.43333333333334
157,Radiolab Colors Thomas Cronin Jules Davidoff Guy Deutscher Victoria Finlay James Gleick YouTube,https://www.youtube.com/watch?v=YRD22dY5lck,9463,88,0,107.5340909090909
158,Radiolab Lost amp Found Lera Boroditsky Emilie Gossiaux Dr Giuseppe Iaria Karen Jacobsen YouTube,https://www.youtube.com/watch?v=05iRv_AfKLQ,3143,29,0,108.37931034482759
159,10 Disney Princess Connections That Will Make Your Jaw Drop YouTube,https://www.youtube.com/watch?v=Ee2lH2jGmJM,2523635,24459,1388,109.3855923020242
160,Radiolab Nukes Bruce Blair Tony De Brum Harold Herring Sonya McMullen William Perry YouTube,https://www.youtube.com/watch?v=LYCp5PfENBI,9865,90,0,109.61111111111111
161,Radiolab Bigger Little Questions Gabriel Barrie Peter Barry Arne Hendriks Tom McCollom YouTube,https://www.youtube.com/watch?v=CL572mKrQzo,2751,25,0,110.04
162,Radiolab What 39 s Up Doc Noel Blanc Sean Cole and Orrin Devinsky YouTube,https://www.youtube.com/watch?v=QJOAVQalvY4,4419,40,0,110.475
163,Radiolab The Ceremony Morgen Peck Peter Todd Peter Van Valkenburgh and Zooko Wilcox YouTube,https://www.youtube.com/watch?v=gWzt6nvECrI,3769,34,0,110.8529411764706
164,Radiolab Stress Dr Kamran Fallahpour Colby Hall Dr Paul J Rosch Dr Robert Sapolsky YouTube,https://www.youtube.com/watch?v=y8QzLHjjNY0,5280,47,0,112.34042553191489
165,Radiolab Radiolab Live Tell Tale Hearts featuring Oliver Sacks YouTube,https://www.youtube.com/watch?v=54jsA4bBz_c,1237,11,0,112.45454545454545
166,Radiolab Sleep Charles Amlaner Steven Lima Dr Allan Pack Hannah Palin Dr Carlos Schenck YouTube,https://www.youtube.com/watch?v=xsCn9cLs2iU,9459,84,0,112.60714285714286
167,Radiolab Animal Minds Patrick Hof Alexandra Horowitz Jonah Lehrer Paul Nicklen Paul Theroux YouTube,https://www.youtube.com/watch?v=clUZ3B9drBc,7890,70,0,112.71428571428571
168,Radiolab After Life Ken Baldwin Paul Broks David Eagleman Gary Greenberg YouTube,https://www.youtube.com/watch?v=y_Nrt3KdyFg,15972,141,0,113.27659574468085
169,Does God exist Neil deGrasse Tyson and Michio Kaku Debate YouTube,https://www.youtube.com/watch?v=DB90bBL2pxk,1763881,17487,1960,113.600888774393
170,Radiolab Falling Joan Murray David Quammen Garrett Soden and Neil deGrasse Tyson YouTube,https://www.youtube.com/watch?v=KizqFgvcrd4,3875,34,0,113.97058823529412
171,10 Animated Movie Villains Who Were Actually Right YouTube,https://www.youtube.com/watch?v=raBNkrqt_kw,4085475,46253,10469,114.17043930248155
172,Radiolab Mortality Reporter Jocelyn Ford Leonard Hayflick Dr Cynthia Kenyon and Lu Olkowski YouTube,https://www.youtube.com/watch?v=n6N2clmGS84,5142,45,0,114.26666666666667
173,Radiolab Revising the Fault Line Dr Robert Sapolsky YouTube,https://www.youtube.com/watch?v=m3Jn87S86cE,5064,54,10,115.0909090909091
174,SML Movie Chef Pee Pee 39 s Kids YouTube,https://www.youtube.com/watch?v=cY7XkPOxMJY,10694119,96186,3715,115.64835461928605
175,Radiolab Father K Matt Apuzzo Reverend Khader El Yateem Kayla Santousouso and Linda Sarsour YouTube,https://www.youtube.com/watch?v=Hr1ubYqZ_bk,1506,13,0,115.84615384615384
176,Radiolab Yellow Fluff and Other Curious Encounters Erica Carmel Jerry Coyne Paul Davies YouTube,https://www.youtube.com/watch?v=d9TyJE95lyQ,4998,43,0,116.23255813953489
177,BEST ANIMATED MOVIES YOU CAN NOT MISS IN 2018 Trailer YouTube,https://www.youtube.com/watch?v=LUFjUl9L70w,2914824,27122,2050,116.25813656668794
178,Another Top 10 Best Celebrity Voice Actor Performances YouTube,https://www.youtube.com/watch?v=5WWvDbQC0zY,6407696,58039,3068,116.56502519510288
