,Title,URL,Views,Likes,Dislikes,Score
0,Taylor Swift Delicate YouTube,https://www.youtube.com/watch?v=tCXGJQYZ9JA,50756650,1742968,100287,30.898665048174294
1,Jidenna Bambi Live from YouTube at SXSW 2017 YouTube,https://www.youtube.com/watch?v=gSchXK9mN0g,249123,5920,139,43.09340944473274
2,Jidenna NPR Music Tiny Desk Concert YouTube,https://www.youtube.com/watch?v=h-_YEiac55s,523606,12295,237,43.423950903964176
3,Dua Lipa IDGAF ft Charli XCX Zara Larsson M xc3 x98 Alma in the Live Lounge YouTube,https://www.youtube.com/watch?v=k1xvol1SCx8,12234178,268334,3318,46.16392217828358
4,Imagine UNICEF World Version YouTube,https://www.youtube.com/watch?v=L7IP4UlXvG8,4712887,101490,1343,47.05969225238899
5,Jidenna on 39 The Chief 39 Dating and His Polygamous Past Digital Originals YouTube,https://www.youtube.com/watch?v=dOD7YQMBCjs,131163,2818,34,47.113146551724135
6,I Copied Ariana Grande 39 s Instagram For a Week YouTube,https://www.youtube.com/watch?v=pvFj9X-ABtM,541569,11914,654,48.09671403197158
7,We Are The World 25 Haiti REACTION YouTube,https://www.youtube.com/watch?v=UKRzNA1Wh8c,20549,413,0,49.75544794188862
8,Drake God xe2 x80 x99s Plan YouTube,https://www.youtube.com/watch?v=xpVfcZ0ZcFM,219833448,4451937,104006,50.56047301578613
9,Jidenna Freestyles On Flex Freestyle 016 YouTube,https://www.youtube.com/watch?v=vKAG4zc4kvw,1162746,20987,260,56.098132870169344
10,Bruno Mars and Cardi B Finesse LIVE From The 60th GRAMMYs xc2 xae YouTube,https://www.youtube.com/watch?v=6OcOO1k-vGE,24938035,450393,19573,57.88504479829163
11,Halsey Hurricane Vevo dscvr Live YouTube,https://www.youtube.com/watch?v=RH4fHNipaEk,2730148,47044,580,58.75835055096419
12,Jidenna Chief Don 39 t Run Live Vevo LIFT YouTube,https://www.youtube.com/watch?v=WEj6Ktkae5s,142580,2473,110,60.33855268726195
13,The Weeknd Kendrick Lamar Pray For Me Lyric Video YouTube,https://www.youtube.com/watch?v=XR7Ev14vUh8,31947970,536900,12189,60.88679292029327
14,Joyful noise Man in the mirror YouTube,https://www.youtube.com/watch?v=ytZsndEc830,4216504,67025,887,63.75312225951798
15,Jidenna On the N Word It 39 s Not a Term of Endearment From Whites YouTube,https://www.youtube.com/watch?v=35i63jf9ChE,286599,4442,237,68.15671819262782
16,Top 5 Songs from the Black Panther Soundtrack YouTube,https://www.youtube.com/watch?v=_pE7cnz6wDU,2194973,33543,1962,69.50296064089167
17,Jay Rock Kendrick Lamar Future James Blake King 39 s Dead YouTube,https://www.youtube.com/watch?v=VwAnsAUYnw4,43833418,633136,28942,72.54858207794186
18,Jidenna Bambi YouTube,https://www.youtube.com/watch?v=K0Eeju2aiGY,11544870,160425,6138,74.82723755079819
19,17 Things You Didn 39 t Know About Ariana Grande YouTube,https://www.youtube.com/watch?v=P5QKBj8HNiw,139288,1870,60,76.95469613259668
20,Jidenna Long Live The Chief Vevo dscvr Live YouTube,https://www.youtube.com/watch?v=bk67TqxQzGo&amp;list=RDbk67TqxQzGo,2463094,32531,835,77.7099318525997
21,Jidenna Long Live The Chief Vevo dscvr Live YouTube,https://www.youtube.com/watch?v=bk67TqxQzGo,2463094,32531,835,77.7099318525997
22,Justin Bieber Sorry Vevo xe2 x80 x99s Do It YourSelfie YouTube,https://www.youtube.com/watch?v=6JuaD57Hquc,2539149,33396,1184,78.82618278902272
23,Dua Lipa Thinking 39 Bout You Official Video YouTube,https://www.youtube.com/watch?v=PLDIhqMWH00,15415519,196497,2435,79.43605136502767
24,Ed Sheeran Shape of You LIVE from the 59th GRAMMYs YouTube,https://www.youtube.com/watch?v=uPvARJW_iVI,4444953,55436,1409,82.27280804042424
25,Jidenna Rhyme and Reason Long Live the Chief YouTube,https://www.youtube.com/watch?v=WdGSB3UdPmc,99842,1256,50,82.787728026534
26,Ariana Grande Inspired Look For A School Dance Make Me Over with TessChristine123 ep 93 YouTube,https://www.youtube.com/watch?v=PoOkdm_7Uno,488885,6040,156,83.08718558803535
27,The Hanging Tree xe2 x80 x99 James Newton Howard ft Jennifer Lawrence Audio YouTube,https://www.youtube.com/watch?v=F3hTW9e20d8,32475347,368605,6867,89.7758792275072
28,Dua Lipa Be The One Official Video YouTube,https://www.youtube.com/watch?v=mgI_pH8TOVY,16828517,191927,4849,89.95454837019852
29,Dua Lipa Be The One Official Video YouTube,https://www.youtube.com/watch?v=mgI_pH8TOVY&amp;list=RDmgI_pH8TOVY,16828517,191927,4849,89.95454837019852
30,Jidenna Classic Man Vevo dscvr Live YouTube,https://www.youtube.com/watch?v=dMlOL6dFkpo,1023005,12154,785,89.98196851086287
31,Ariana Grande Focus Vevo xe2 x80 x99s Do It YourSelfie YouTube,https://www.youtube.com/watch?v=OcEGRLP1TKM,1542242,17935,1114,91.68551215742227
32,Fifth Harmony Work From Home Vevo xe2 x80 x99s Do It YourSelfie YouTube,https://www.youtube.com/watch?v=g0f6QXmIueY,1558874,17558,639,92.13747857438383
33,CNCO Bandmates YouTube,https://www.youtube.com/watch?v=1mfY_54Cfjw,3718080,39968,1208,95.92569659442725
34,Jidenna Long Live the Chief YouTube,https://www.youtube.com/watch?v=H_AQFnqMY3E,17295878,184823,6956,97.24051116845733
35,Selena Gomez Same Old Love Vevo xe2 x80 x99s Do It YourSelfie YouTube,https://www.youtube.com/watch?v=kfSXAIC17vE,800619,8874,645,97.29238060517682
36,Dua Lipa New Rules Acoustic Version YouTube,https://www.youtube.com/watch?v=XACJcsGY2yI,4747066,47999,1023,101.05300579019074
37,Bruno Mars That 39 s What I Like LIVE from the 59th GRAMMYs YouTube,https://www.youtube.com/watch?v=CDq15rSoOPc,8303826,84077,3330,102.83757910510607
38,Harry Styles Sign of the Times YouTube,https://www.youtube.com/watch?v=qN4ooNx77u0,316148000,3087213,93462,105.6026369594532
39,Silent xc3 xb3 Watch Me Whip Nae Nae Vevo 39 s Dancing For Love w Fik Shun YouTube,https://www.youtube.com/watch?v=D39Fto47_gQ,1990483,19314,497,105.78110219482383
40,Demi Lovato Iggy Azalea Certified SuperFanFest Full Version YouTube,https://www.youtube.com/watch?v=h9qpdgJgBNg,3172078,30810,1069,106.65673649171178
41,Iggy Azalea A K A Iggy Azalea YouTube,https://www.youtube.com/watch?v=ZOqnVuxN3Hg,1962652,20422,2048,106.81680635680853
42, quot Ew quot with Ariana Grande YouTube,https://www.youtube.com/watch?v=FSNasZ5W_8A,49833277,482090,19880,107.81522900845935
43,Jidenna Chief Don 39 t Run YouTube,https://www.youtube.com/watch?v=WiUibQxWgik,10807434,103877,3940,108.14246975594625
44,Lana Del Rey Once Upon a Dream Maleficent quot Dream quot Trailer YouTube,https://www.youtube.com/watch?v=ihgvGPlSkXE,6802380,64106,1325,108.35093419983752
45,Selena Gomez Hands To Myself Vevo xe2 x80 x99s Do It YourSelfie YouTube,https://www.youtube.com/watch?v=mjOFfdhIVlE,1893157,18371,1106,109.65288155227339
46,Ariana Grande Love Me Harder Vevo xe2 x80 x99s Do It YourSelfie YouTube,https://www.youtube.com/watch?v=nLStb1uUFOU,2007226,19604,1572,111.3146628216504
47,Ariana Grande Love Me Harder Vevo xe2 x80 x99s Do It YourSelfie YouTube,https://www.youtube.com/watch?v=nLStb1uUFOU&amp;list=RDnLStb1uUFOU,2007226,19604,1572,111.3146628216504
48,The Hanging Tree Rebel Remix From The Hunger Games Mockingjay Part 1 Audio YouTube,https://www.youtube.com/watch?v=YNrBBfqWpzE,11336482,106344,5105,111.97741976906133
49,Jidenna Interview 39 The Purpose of Long Live The Chief 39 AmaruDonTV YouTube,https://www.youtube.com/watch?v=IUR0Dcs86QA,82591,741,11,113.13835616438357
50,Becky G Lovin xe2 x80 x99 So Hard Vevo xe2 x80 x99s Do It YourSelfie presented by COVERGIRL YouTube,https://www.youtube.com/watch?v=I1w7XhSC7Gg,890906,8337,550,114.40940028252216
51,The Weeknd Can 39 t Feel My Face Vevo 39 s Dancing For Love YouTube,https://www.youtube.com/watch?v=_e6kwGAaE5k,2212676,19549,474,115.99874180865007
52,We are the world Korea Cover xec x9c x84 xec x95 x84 xeb x8d x94 xec x9b x94 xeb x93 x9c xec xbd x94,https://www.youtube.com/watch?v=s0Ti4cpztL8,2381187,21881,1720,118.10857596349388
53,Lorde Green Light YouTube,https://www.youtube.com/watch?v=dMK_npDG12Q,108389864,983333,67742,118.38240437051041
54,Ariana Grande 39 s Shadiest Diva Moments YouTube,https://www.youtube.com/watch?v=ea4_rM1zK9s,347742,3149,281,121.2489539748954
55,Various Artists We Are The World 25 for Haiti YouTube,https://www.youtube.com/watch?v=S0NfzmgNvSA,8353986,71538,3011,121.90794869175653
56,Ariana Grande Problem Vevo xe2 x80 x99s Do It YourSelfie ft Iggy Azalea YouTube,https://www.youtube.com/watch?v=oTbHzQDqWYU,1327007,11821,1094,123.70718747086791
57,Jidenna quot Long Live The Chief quot Live in Atlanta YouTube,https://www.youtube.com/watch?v=ZMt8MzldScM,52728,425,0,124.06588235294117
58,Janelle Mon xc3 xa1e Jidenna Yoga YouTube,https://www.youtube.com/watch?v=0OkB6p_FZAw,42672050,361347,18927,124.61903510308977
59,Katy Perry Last Friday Night Vevo xe2 x80 x99s Do It YourSelfie YouTube,https://www.youtube.com/watch?v=J55ubQGFrrg,4593421,39146,2901,126.73254241964409
60,Dua Lipa Lost In Your Light feat Miguel Official Video YouTube,https://www.youtube.com/watch?v=r-AuLm7S3XE,38134023,307757,9632,127.91286540880503
61,Meghan Trainor Lips Are Movin Vevo xe2 x80 x99s Do It YourSelfie YouTube,https://www.youtube.com/watch?v=LLYFPOEoL-c,2481400,20291,1494,132.01042719582912
62,Jidenna Classic Man Remix ft Kendrick Lamar YouTube,https://www.youtube.com/watch?v=URiDdlAS6ls,44092261,338986,14515,135.8896819746603
63,Silent xc3 xb3 Vevo GO Shows Watch Me Whip Nae Nae YouTube,https://www.youtube.com/watch?v=F_UyUNDRbSU,3190075,24776,1744,138.50620875303926
64,Shawn Mendes There 39 s Nothing Holdin 39 Me Back YouTube,https://www.youtube.com/watch?v=dT2owtxkU8k,485633018,3581775,88511,139.01984447782934
65,Beyonc xc3 xa9 7 11 Vevo xe2 x80 x99s Do It YourSelfie YouTube,https://www.youtube.com/watch?v=5-KHYU5ShJ8,1409029,10607,1329,151.86775167061867
66,Ed Sheeran Perfect Official Music Video YouTube,https://www.youtube.com/watch?v=2Vv-BfVoq4g,867860847,5861362,207100,153.48790823630034
67,Iggy Azalea Black Widow Vevo xe2 x80 x99s Do It YourSelfie YouTube,https://www.youtube.com/watch?v=Ep_rnTTG_Mg,2019138,15537,2413,153.85080768058518
68,Ellie Goulding Love Me Like You Do Vevo xe2 x80 x99s Do It YourSelfie YouTube,https://www.youtube.com/watch?v=K7YjVTmUKAI,1793771,13602,1994,154.5288594073053
69,Miley Cyrus Bangerz VEVO Tour Exposed YouTube,https://www.youtube.com/watch?v=E8OAJKl9T44,4247937,32801,5326,154.61099181073703
70,Sebastian Ingrosso Tommy Trash John Martin Reload YouTube,https://www.youtube.com/watch?v=GuAtcpFQpMw,62802122,411713,7438,155.34505472759878
71,Sean Paul No Lie ft Dua Lipa YouTube,https://www.youtube.com/watch?v=GzU8KqOY8YA,322515215,2086767,61312,159.23099501099753
72,Meghan Trainor Better When I 39 m Dancin 39 Vevo xe2 x80 x99s Do It YourSelfie YouTube,https://www.youtube.com/watch?v=8qTrVvdDlqQ,1198599,8408,959,160.9073701167942
73,Imagine Dragons Thunder YouTube,https://www.youtube.com/watch?v=fKopy74weus,615008655,3993878,196627,161.96154928920947
74,The Making of quot We Are the World quot USA for Africa 1985 YouTube,https://www.youtube.com/watch?v=JIlKfKYxfXY,1745512,10742,356,168.0639322164452
75,Camila Cabello Havana Audio ft Young Thug YouTube,https://www.youtube.com/watch?v=HCjNJDNzw8Y,898554907,5085425,228062,184.98821418123373
76,Chino y Nacho Vevo GO Shows Me Voy Enamorando YouTube,https://www.youtube.com/watch?v=vPaNkt8eNrQ,6347783,35892,1994,187.26128385155465
77,5 Things You Didn 39 t Know About Ariana Grande YouTube,https://www.youtube.com/watch?v=k-DAt4bD8eY,3486463,21976,3497,188.67162725255696
78,USA for Africa We are the World YouTube,https://www.youtube.com/watch?v=M9BNoNFKCBI,105519943,578294,21312,189.4494669486626
79,Dua Lipa Be The One Official Music Video YouTube,https://www.youtube.com/watch?v=-rey3m8SWQI,185745203,995646,34529,193.25972072078633
80,Luis Fonsi Demi Lovato xc3 x89chame La Culpa YouTube,https://www.youtube.com/watch?v=TyHvyGVs42U,1061966391,5904286,424529,193.7980810097966
81,Chris Stapleton Fire Away Vevo dscvr Live YouTube,https://www.youtube.com/watch?v=18AhUXAILWE,3511390,18545,584,195.50080730471578
82,Young Artists For Haiti Wavin 39 Flag YouTube,https://www.youtube.com/watch?v=nB7L1BIDELc,24348682,125950,2506,197.24475875700722
83,Bebe Rexha Meant to Be feat Florida Georgia Line Official Music Video YouTube,https://www.youtube.com/watch?v=zDo0H8Fm7d0,276263230,1455615,67607,199.03576204171733
84, quot You look like a child quot Ariana Grande RUDEST Interviewer EVER YouTube,https://www.youtube.com/watch?v=bzV3dshrOuI,3528264,24247,6671,200.74328629949932
85,We Are The World 25 Official Music Video with lyrics and names YouTube,https://www.youtube.com/watch?v=EqGmN_epWRI,1642895,8431,353,203.37893042832386
86,Zara Larsson Lush Life YouTube,https://www.youtube.com/watch?v=tD4HCZe-tew,539633300,2711581,86882,205.5981657325278
87,Michael Jackson We Are The World HQ YouTube,https://www.youtube.com/watch?v=O6cE4DJUb_o,19014453,94850,2867,206.7170346694498
88,Ariana Grande The Weeknd Love Me Harder YouTube,https://www.youtube.com/watch?v=g5qU7p7yOY8,521915017,2642449,133208,207.9971660753192
89,Rita Ora Anywhere Official Video YouTube,https://www.youtube.com/watch?v=ksdAs4LBRq8,126955064,623765,25671,212.26607188836536
90,Michael Jackson quot We Are The World quot live at World Music Awards 2006 HD YouTube,https://www.youtube.com/watch?v=O7y9aMIJG00,9932861,48444,1896,213.3896408008937
91,Naughty Boy Runnin 39 Lose It All ft Beyonc xc3 xa9 Arrow Benjamin YouTube,https://www.youtube.com/watch?v=eJSik6ejkr0,273048484,1315286,49658,215.7415006621219
92,Sam Smith Too Good At Goodbyes Official Video YouTube,https://www.youtube.com/watch?v=J_ub7Etch2U,651816477,2956236,138339,231.31309519120109
93,Michael Jackson amp Britney Spears Duet The Way You Make Me Feel HD Remaster YouTube,https://www.youtube.com/watch?v=VrTC3FHE8No,6266227,26478,1799,253.90927509218363
94,Whitney Houston amp Michael Jackson One Moment In Time amp You Were There YouTube,https://www.youtube.com/watch?v=l7aEeLG3l1U,36329733,127695,7651,302.63680817033753
95,See What Happens When A Plane Violates Presidential Airspace TODAY YouTube,https://www.youtube.com/watch?v=IgL5jOypOQ8,11731105,48487,13015,330.7145072169599
96,Lil Wayne Mirror Teaser ft Bruno Mars YouTube,https://www.youtube.com/watch?v=ixHb7mRnMQ4,6019456,20839,2716,332.14456767643327
97,Simon Asks Him To Sing Acapella Watch What Happens Next Boot Camp The X Factor UK 2017 YouTube,https://www.youtube.com/watch?v=93KZfojHPog,23348835,62303,8969,437.7851839352008
98,12 Days of Christmas YouTube,https://www.youtube.com/watch?v=MG4XPVmF6J0,2484249,2677,1524,2154.5958369470945
99,Lady Gaga amp Beyonc xc3 xa9 Telephone VEVO Premiere YouTube,https://www.youtube.com/watch?v=r8GXHS4s9K4,4182702,4950,3500,2884.6220689655174
